[
  {
    "videoId": "EigRVjWUKZg",
    "title": "Uzko IV. Asteazkena. Lekunberri",
    "publishedAt": "2026-02-04T15:45:36Z"
  },
  {
    "videoId": "R3imjYjfNIU",
    "title": "Beato Esteban Bellezini. Agustinas Aldatz. Bendición alimentos San Blas",
    "publishedAt": "2026-02-03T09:40:59Z"
  },
  {
    "videoId": "ocVPq0FwHtE",
    "title": "Jaunaren Aurkezpenaren Meza. Lekunberri",
    "publishedAt": "2026-02-02T20:49:19Z"
  },
  {
    "videoId": "MDGqOAa16HU",
    "title": "Uzko IV Igandea. Lekunberri",
    "publishedAt": "2026-02-01T08:50:34Z"
  },
  {
    "videoId": "M2YaIeOyS3o",
    "title": "San Juan Bosco. Agustinas Aldatz",
    "publishedAt": "2026-01-31T08:48:42Z"
  },
  {
    "videoId": "qM2zlfaxMjo",
    "title": "Uzko III. Ostirala. Beteluko Ermita",
    "publishedAt": "2026-01-30T11:21:33Z"
  },
  {
    "videoId": "OCTwYyYDwXA",
    "title": "Misa por los Sacerdotes. Casa Cristo Rey. Pozuelo de Alarcón",
    "publishedAt": "2026-01-29T08:26:35Z"
  },
  {
    "videoId": "rnyBkvNdtd0",
    "title": "Santo Tomás de Aquino. Casa Cristo Rey. Pozuelo de Alarcón",
    "publishedAt": "2026-01-28T07:49:36Z"
  },
  {
    "videoId": "_TqLwF_Pvxo",
    "title": "Misa Votiva del Espíritu Santo. Casa Cristo Rey Pozuelo de Alarcón",
    "publishedAt": "2026-01-27T07:43:23Z"
  },
  {
    "videoId": "qBrOskEa8cE",
    "title": "Hileta Conchi Martín Esnaola. Etxarri-Larraun",
    "publishedAt": "2026-01-26T09:08:01Z"
  },
  {
    "videoId": "gUPkWdPvdHE",
    "title": "Uzko III. Igandea. Leitza",
    "publishedAt": "2026-01-25T11:08:13Z"
  },
  {
    "videoId": "9PUi7Om9gfM",
    "title": "San Francisco de Sales. Agustinas Aldatz",
    "publishedAt": "2026-01-24T08:55:35Z"
  },
  {
    "videoId": "a2k4AxOAwz0",
    "title": "San Ildefontso. Beteluko Ermita",
    "publishedAt": "2026-01-23T10:57:52Z"
  },
  {
    "videoId": "SXHTMNzMG34",
    "title": "San Vicente Mártir. Agustinas Aldatz",
    "publishedAt": "2026-01-22T09:29:09Z"
  },
  {
    "videoId": "Io3rW7DUcbI",
    "title": "Santa Inés. Lekunberri",
    "publishedAt": "2026-01-21T18:15:45Z"
  },
  {
    "videoId": "eEPj6WB3wOM",
    "title": "Martes 2ª Semana T. O. Agustinas Aldatz. Octavario de Oración por la Unidad de los Cristianos",
    "publishedAt": "2026-01-20T08:56:54Z"
  },
  {
    "videoId": "BOXd4UypaWs",
    "title": "19 de enero de 2026",
    "publishedAt": "2026-01-20T00:35:52Z"
  },
  {
    "videoId": "U9VnUNbQzO0",
    "title": "Uzko II. Igandea. Arano",
    "publishedAt": "2026-01-18T11:24:31Z"
  },
  {
    "videoId": "UemqVWAjLsk",
    "title": "San Anton Bedeinkapena eta Meza. Goizueta",
    "publishedAt": "2026-01-17T12:32:22Z"
  },
  {
    "videoId": "dlZULqBPDqE",
    "title": "Uzko I. Ostirala. Beteluko Ermita",
    "publishedAt": "2026-01-16T11:14:15Z"
  },
  {
    "videoId": "wmw7lUTROQk",
    "title": "Uzko I. Osteguna. Lekunberri",
    "publishedAt": "2026-01-15T18:05:16Z"
  },
  {
    "videoId": "dLMAXJH1Z9o",
    "title": "Uzko I. Asteazkena. Leitza",
    "publishedAt": "2026-01-14T19:24:38Z"
  },
  {
    "videoId": "Gp0uLMonyKA",
    "title": "Martes I Semana T. O. Agustinas Aldatz. 13/01/26",
    "publishedAt": "2026-01-13T08:54:14Z"
  },
  {
    "videoId": "_i1lLVHVuEk",
    "title": "Uzko I. Astelehena. Lekunberri",
    "publishedAt": "2026-01-12T19:03:01Z"
  },
  {
    "videoId": "v9aITJ01OR8",
    "title": "Jaunaren Bataioa. Betelu",
    "publishedAt": "2026-01-11T13:12:43Z"
  },
  {
    "videoId": "-T--aw1Aws8",
    "title": "Jaunaren Bataioa. Lekunberri",
    "publishedAt": "2026-01-10T19:50:54Z"
  },
  {
    "videoId": "hZdLUFleGe8",
    "title": "Urtarrilaren 9a. Beteluko Ermita",
    "publishedAt": "2026-01-09T11:28:02Z"
  },
  {
    "videoId": "AGScMzqD5s0",
    "title": "Urtarrilaren 8a. Lekunberri",
    "publishedAt": "2026-01-08T18:04:39Z"
  },
  {
    "videoId": "qiH6fRd6Buw",
    "title": "Urtarrilaren 7a. Leitza",
    "publishedAt": "2026-01-07T19:41:48Z"
  },
  {
    "videoId": "SysvJ2wjqcU",
    "title": "Jaunaren Agerkundea. Lekunberriko Koroarekin",
    "publishedAt": "2026-01-06T11:22:25Z"
  },
  {
    "videoId": "mTL9oy7HGDo",
    "title": "Agerkundeko Meza. Leitza",
    "publishedAt": "2026-01-05T23:24:38Z"
  },
  {
    "videoId": "_IMCqfoFeCY",
    "title": "Hiru erregen bezperako kantuak. Betelu",
    "publishedAt": "2026-01-05T15:07:31Z"
  },
  {
    "videoId": "nCOXyCM7hw8",
    "title": "Compendium Pragmaticum Pastoralis-en aurkezpena. Elizpe aretoa Donostiko Artzain Onaren  katedrala",
    "publishedAt": "2026-01-04T17:38:23Z"
  },
  {
    "videoId": "e35nBP-cLIg",
    "title": "Eguberri ondoko II. Igandea. Arano",
    "publishedAt": "2026-01-04T11:28:30Z"
  },
  {
    "videoId": "U7lF6-azfNE",
    "title": "Eguberriko II. Igandea. Leitza",
    "publishedAt": "2026-01-03T20:37:27Z"
  },
  {
    "videoId": "nPjnqsWjtTA",
    "title": "San Gregorio Nacianceno y San Basilio Magno. 02/01/26. Marin",
    "publishedAt": "2026-01-02T09:03:41Z"
  },
  {
    "videoId": "bOs6M8NIeok",
    "title": "Santa María Madre de Dios, Misa de Víspera. Marín",
    "publishedAt": "2025-12-31T20:16:57Z"
  },
  {
    "videoId": "PUEjRMQz5yM",
    "title": "VI día de la Octava de Navidad. Agustinas Aldatz",
    "publishedAt": "2025-12-30T08:43:44Z"
  },
  {
    "videoId": "Ww-b5n2wBio",
    "title": "Eguberri-zortziurreneko V eguna. Lekunberri",
    "publishedAt": "2025-12-29T18:21:32Z"
  },
  {
    "videoId": "WZMLZXBMS4E",
    "title": "Fermín Ixurko.ren omenaldia bere 100garren urtebetetza",
    "publishedAt": "2025-12-29T14:25:47Z"
  },
  {
    "videoId": "_iNAg-4ff5o",
    "title": "Familia Santua: Jesus, Maria eta Jose. Areso",
    "publishedAt": "2025-12-28T10:40:04Z"
  },
  {
    "videoId": "CX-m17a-gkE",
    "title": "Sagrada Familiaren Meza. Lekunberri",
    "publishedAt": "2025-12-27T22:01:08Z"
  },
  {
    "videoId": "TS9pKufoJeo",
    "title": "San Esteban, lehen martiria. Beteluko Ermita",
    "publishedAt": "2025-12-26T11:47:21Z"
  },
  {
    "videoId": "VTlZFfcKp2o",
    "title": "Jaunaren Jaiotza. Bezpera-arratsaldeko Meza. Lekunberri",
    "publishedAt": "2025-12-24T18:45:15Z"
  },
  {
    "videoId": "LfrqOZ5r3no",
    "title": "EGUBERRI ON",
    "publishedAt": "2025-12-24T18:25:49Z"
  },
  {
    "videoId": "srCTrWZJssU",
    "title": "Misa 23 Diciembre. Agustinas Aldatz",
    "publishedAt": "2025-12-23T08:51:53Z"
  },
  {
    "videoId": "OvRDvgvKsMo",
    "title": "Abenduaren 22ko. meza. Lekunberri",
    "publishedAt": "2025-12-22T18:29:14Z"
  },
  {
    "videoId": "uCchQMn0z44",
    "title": "Abendualdiko IV. Igandea. Arano",
    "publishedAt": "2025-12-21T12:02:33Z"
  },
  {
    "videoId": "_-CFfulP6iY",
    "title": "Abendualdiko IV. Igandea. Lekunberri",
    "publishedAt": "2025-12-20T19:26:01Z"
  },
  {
    "videoId": "gLAmZEpB3so",
    "title": "Abenduaren 19ko meza. Sta Kruz Beteluko Ermita",
    "publishedAt": "2025-12-19T11:34:43Z"
  },
  {
    "videoId": "js-pPOz5q3I",
    "title": "Abenduaren 18ko meza. Lekunberri",
    "publishedAt": "2025-12-18T19:03:41Z"
  },
  {
    "videoId": "k3ib0J2ojZI",
    "title": "Abenduaren 17ko meza. Leitza",
    "publishedAt": "2025-12-17T19:22:43Z"
  },
  {
    "videoId": "az9GX3K2NzY",
    "title": "Hileta Luis Maria Beguiristain Madoz. 2025/12/16. Lekunberri",
    "publishedAt": "2025-12-16T17:26:15Z"
  },
  {
    "videoId": "nR3fL91eLKA",
    "title": "Martes III Adviento. 16/12/25. Agustinas Aldatz",
    "publishedAt": "2025-12-16T08:57:51Z"
  },
  {
    "videoId": "_CyHRtBpiUc",
    "title": "Abenduko III. Astelehena. 2025/12/15. Lekunberri",
    "publishedAt": "2025-12-15T18:25:00Z"
  },
  {
    "videoId": "Ip1oVVEHcLU",
    "title": "Abendualdiko III. Igandea. Gaudete. 2025/12/14. Betelu",
    "publishedAt": "2025-12-14T13:53:38Z"
  },
  {
    "videoId": "83gVEaC1Nqg",
    "title": "Abendualdiko III. Igandea. \"Gaudete\". 13/12/25. Leitza.",
    "publishedAt": "2025-12-13T20:04:39Z"
  },
  {
    "videoId": "uOHbkxM8wgI",
    "title": "Abenduko II. Ostirala. 12/12/25. Beteluko Ermita",
    "publishedAt": "2025-12-12T10:57:42Z"
  },
  {
    "videoId": "jFBVlbqzoUo",
    "title": "Jueves II semana Adviento. 11/12/25. Agustinas Aldatz",
    "publishedAt": "2025-12-11T08:52:15Z"
  },
  {
    "videoId": "vTAuUOdOpLc",
    "title": "Hileta Imanol De Marcos Ibáñez. 10/12/25. Intza",
    "publishedAt": "2025-12-10T17:58:03Z"
  },
  {
    "videoId": "uc8rDYCJEOo",
    "title": "Martes II Semana Adviento. 09/12/25. Agustinas Aldatz",
    "publishedAt": "2025-12-09T08:55:15Z"
  },
  {
    "videoId": "q1xes_An-nU",
    "title": "Maria Sortzez Garbia eta Mª Esperanza López Valles. 08/12/25. Atallu",
    "publishedAt": "2025-12-08T17:46:41Z"
  },
  {
    "videoId": "TN1UYlwe4ic",
    "title": "Maria Sortzez Garbia eta Lontxa Gorostegi Zabala. 07/12/25. Uitzi",
    "publishedAt": "2025-12-07T17:22:34Z"
  },
  {
    "videoId": "vth27VcMv5s",
    "title": "Abendualdiko II. Igandea. 06/12/25. Lekunberri",
    "publishedAt": "2025-12-06T19:06:01Z"
  },
  {
    "videoId": "-J-uXHtgry4",
    "title": "Abenduko I. Ostirala. 05/12/25. Santa Kruz Ermita Beteluko",
    "publishedAt": "2025-12-05T11:17:15Z"
  },
  {
    "videoId": "_modhc-P0cI",
    "title": "Abenduko I. Osteguna 04/12/25. Goldaratz",
    "publishedAt": "2025-12-04T17:10:10Z"
  },
  {
    "videoId": "86gL63ICk4E",
    "title": "Xabierko San Frantzisko. 03/12/25. Lekunberri",
    "publishedAt": "2025-12-03T09:12:00Z"
  },
  {
    "videoId": "VyDO9w9NxR4",
    "title": "Martes 1ª Semana Adviento. 02/12/25. Agustinas Aldatz",
    "publishedAt": "2025-12-02T09:20:36Z"
  },
  {
    "videoId": "XOs425tPutw",
    "title": "Abenduko I astelehena. 01/12/25. Lekunberri",
    "publishedAt": "2025-12-01T18:04:37Z"
  },
  {
    "videoId": "4pLNccBCyVs",
    "title": "Abendualdiko I. Igandea. 30/11/25. Arano",
    "publishedAt": "2025-11-30T11:22:03Z"
  },
  {
    "videoId": "icctAsuFuQM",
    "title": "Misa Virgen Carmen. 28/11/25. Carmelitas San Lorenzo de El Escorial",
    "publishedAt": "2025-11-28T12:46:28Z"
  },
  {
    "videoId": "dL5P59Njc8M",
    "title": "La Milagrosa. 27/11/25. Agustinas Aldatz",
    "publishedAt": "2025-11-27T08:46:03Z"
  },
  {
    "videoId": "pOOh8aKDlFw",
    "title": "Erasopean bizi diren kristauentzat. 26/11/25. Lekunberri",
    "publishedAt": "2025-11-26T11:36:10Z"
  },
  {
    "videoId": "gQK7bOF8FfI",
    "title": "Martes XXXIV T. O. 25/11/25. Agustinas Aldatz",
    "publishedAt": "2025-11-25T09:09:44Z"
  },
  {
    "videoId": "f_SOmLwQPPQ",
    "title": "San Andrés Dung-Lac y compañeros. 24/11/25. Lekunberri",
    "publishedAt": "2025-11-24T18:11:17Z"
  },
  {
    "videoId": "JbsNZK8Cr68",
    "title": "Kristo Erregearen Festaburua. 23/11 /25. Betelu",
    "publishedAt": "2025-11-23T13:02:12Z"
  },
  {
    "videoId": "L1DNfuPGa6o",
    "title": "Kristo Erregearen Solemnitatea, eta Susana Eguzquizaren aldeko Meza. 22/22/25. Lekunberri",
    "publishedAt": "2025-11-22T18:51:13Z"
  },
  {
    "videoId": "H3c1x59vyrI",
    "title": "Presentación de la Virgen Maria. 21/11/25. Lekunberri",
    "publishedAt": "2025-11-21T18:29:40Z"
  },
  {
    "videoId": "3FJ_HZsot8I",
    "title": "Uzko XXXIII. Osteguna. Lekunberri",
    "publishedAt": "2025-11-20T18:32:02Z"
  },
  {
    "videoId": "aIm2hSoGA_k",
    "title": "Uzko XXXIII Asteazkena. Leitza",
    "publishedAt": "2025-11-19T19:32:49Z"
  },
  {
    "videoId": "tCMzxWIqkKk",
    "title": "XXXIII TO. Martes 18/11/25. Agustinas. Aldatz",
    "publishedAt": "2025-11-18T08:50:55Z"
  },
  {
    "videoId": "c4rVdhHTkEw",
    "title": "Hungariako Santa Isabel. 17/11/25. Lekunberri",
    "publishedAt": "2025-11-17T19:56:41Z"
  },
  {
    "videoId": "t2i2la-FEFo",
    "title": "Uzko XXXII Ostirala. Beteluko Ermita",
    "publishedAt": "2025-11-14T11:50:43Z"
  },
  {
    "videoId": "WrLJC3dJiwY",
    "title": "Espiritu Santuaren Meza. 13/11/25. Lekunberri",
    "publishedAt": "2025-11-13T19:53:29Z"
  },
  {
    "videoId": "sqEBLI3Xk1Y",
    "title": "San Josafat. 12/11/25. Leitza",
    "publishedAt": "2025-11-12T19:19:16Z"
  },
  {
    "videoId": "ZtXakyjfYfw",
    "title": "Tourseko San Martin. 11/11/25. Gaintza",
    "publishedAt": "2025-11-11T14:20:46Z"
  },
  {
    "videoId": "3TdPxF5dZuk",
    "title": "San Martin de Tours. 11/11/25. Agustinas Aldatz. 134º Aniv. Fundación Convento",
    "publishedAt": "2025-11-11T08:53:12Z"
  },
  {
    "videoId": "aA-Fh2guzQw",
    "title": "San Leon Handia. 10/11/25. Lekunberri",
    "publishedAt": "2025-11-10T19:16:50Z"
  },
  {
    "videoId": "u0RnCgb51ek",
    "title": "Hileta Maria Josefa Arregui Arregui. 09/11/25. Aldatz",
    "publishedAt": "2025-11-09T17:35:18Z"
  },
  {
    "videoId": "_uAiywCGidE",
    "title": "San Joan Laterango basilika nagusiaren dedikazioa. 08/11/25. Lekunberriko parrokoaren kargu-hartzea",
    "publishedAt": "2025-11-08T21:33:26Z"
  },
  {
    "videoId": "g8vK-YPZjGs",
    "title": "Uzko XXXI Ostirala. 07/11/25. Beteluko Ermita",
    "publishedAt": "2025-11-07T13:50:05Z"
  },
  {
    "videoId": "6Xg9St3ZTS8",
    "title": "Erlijio-jazarpeneko martiri dohatsuak. 06/11/26. Goldaratz",
    "publishedAt": "2025-11-06T14:36:39Z"
  },
  {
    "videoId": "XrfP5AbuNQA",
    "title": "Miercoles 05/11/25. Agustinas Aldatz",
    "publishedAt": "2025-11-05T09:47:24Z"
  },
  {
    "videoId": "oOz5vrs6IuQ",
    "title": "San Carlos Borromeo. 04/11/25. Agustinas Aldatz",
    "publishedAt": "2025-11-04T08:55:53Z"
  },
  {
    "videoId": "0ALevP2D_jY",
    "title": "Hileta. Benita Sasturain Alberro. Jauntsarats",
    "publishedAt": "2025-11-03T10:04:10Z"
  },
  {
    "videoId": "VC7dTQ7Au10",
    "title": "Hildako Guztien Eguna. 02/11/25. Arano",
    "publishedAt": "2025-11-02T11:32:31Z"
  },
  {
    "videoId": "X28TsuOLxD8",
    "title": "Santu Guztien Eguna. 01/11/25. Lekunberri",
    "publishedAt": "2025-11-01T09:47:37Z"
  },
  {
    "videoId": "DXGgL6dw7TE",
    "title": "Uzko XXX. Ostirala. 31/10 /25. Betelu",
    "publishedAt": "2025-10-31T11:36:26Z"
  },
  {
    "videoId": "PVYrqLTRmHo",
    "title": "Jueves 30/10/25. Agustinas Aldatz",
    "publishedAt": "2025-10-30T08:54:38Z"
  },
  {
    "videoId": "uCtb627Pk2Q",
    "title": "Uzko XXX. Asteazkena. 29/10/25. Leitza",
    "publishedAt": "2025-10-29T19:24:12Z"
  },
  {
    "videoId": "iCCDshCxFrc",
    "title": "Simon y Tadeo Apóstoles. 28/10/25. Agustinas Aldatz",
    "publishedAt": "2025-10-28T08:46:56Z"
  },
  {
    "videoId": "GWKxDsoH-rA",
    "title": "Agustinas Aldatz. 27/10/25",
    "publishedAt": "2025-10-27T09:10:38Z"
  },
  {
    "videoId": "igYald-bRpA",
    "title": "Urko XXX Igandea. Leitza",
    "publishedAt": "2025-10-26T12:52:34Z"
  },
  {
    "videoId": "EfF8LbFCPH0",
    "title": "Urtean Zeharreko XXX. Igandea. Lekunberri",
    "publishedAt": "2025-10-25T18:12:45Z"
  },
  {
    "videoId": "iMrrwW_CCOE",
    "title": "Uzko XXIX. Ostirala. 24/10/25. Beteluko Ermita",
    "publishedAt": "2025-10-24T10:35:21Z"
  },
  {
    "videoId": "9VA1uZYb3IE",
    "title": "Jueves 23/10/25. Lekunberri",
    "publishedAt": "2025-10-23T17:02:07Z"
  },
  {
    "videoId": "E1TGsk2LKXw",
    "title": "San Joan Paulo IIa. (Leitza)",
    "publishedAt": "2025-10-22T18:17:41Z"
  },
  {
    "videoId": "wDFFG-imn1A",
    "title": "Agustinas Aldatz. 21/10/25",
    "publishedAt": "2025-10-21T07:59:26Z"
  },
  {
    "videoId": "5FAgioTJIB8",
    "title": "Hileta Geno Telletxea Elizalde. Areso",
    "publishedAt": "2025-10-20T17:02:56Z"
  },
  {
    "videoId": "p2ynP4uo9Ag",
    "title": "DOMUND Igandea. 19/10/25. Betelu",
    "publishedAt": "2025-10-19T11:42:40Z"
  },
  {
    "videoId": "4mE4L83LG_8",
    "title": "San Lukas. Uitzi",
    "publishedAt": "2025-10-18T10:04:38Z"
  },
  {
    "videoId": "qewjQ08wlvU",
    "title": "Antiokiako San Inaxio. Beteluko Ermita 17/10/25",
    "publishedAt": "2025-10-17T11:14:54Z"
  },
  {
    "videoId": "pJ96uKXS2hw",
    "title": "UZko XXVIII. Osteguna (Leitza)",
    "publishedAt": "2025-10-16T20:02:04Z"
  },
  {
    "videoId": "ZTC3NsS69_o",
    "title": "Hileta - Ramón Garmendia Insausti. 13/10/25 (Betelu)",
    "publishedAt": "2025-10-13T17:07:29Z"
  },
  {
    "videoId": "jDGqm8DVnW4",
    "title": "Pilareko Amaren Bederatziurrena bederaratzigarren eguna",
    "publishedAt": "2025-10-12T08:08:16Z"
  },
  {
    "videoId": "oaoPhHdiPvI",
    "title": "Pilareko Amaren Bederatziurrena zortzigarren eguna",
    "publishedAt": "2025-10-11T07:38:07Z"
  },
  {
    "videoId": "HW39By1_XZM",
    "title": "Pilareko Amaren Bederatziurrena zazpigarren eguna",
    "publishedAt": "2025-10-10T08:30:14Z"
  },
  {
    "videoId": "OokXXIWwdns",
    "title": "Pilareko Amaren Bederatziurrena seigarren eguna",
    "publishedAt": "2025-10-09T07:20:53Z"
  },
  {
    "videoId": "Sk880RGSxbY",
    "title": "Pilareko Amaren Bederatziurrena bostgarren eguna",
    "publishedAt": "2025-10-08T08:35:24Z"
  },
  {
    "videoId": "BmOAGSPWEg0",
    "title": "Pilareko Amaren Bederatziurrena. 4. eguna (Lekunberri)",
    "publishedAt": "2025-10-07T08:32:46Z"
  },
  {
    "videoId": "r6Dui5HPs54",
    "title": "Pilareko Amaren Bederatziurrena. 3. eguna (Lekunberri)",
    "publishedAt": "2025-10-06T13:36:20Z"
  },
  {
    "videoId": "52F4I6VPXdQ",
    "title": "Pilareko Amaren Bederatziuerrena. 2. eguna (Lekunberri)",
    "publishedAt": "2025-10-05T07:47:27Z"
  },
  {
    "videoId": "AxOJS6m3MAs",
    "title": "Pilareko Amaren Bederatziurrena (Lekunberri)",
    "publishedAt": "2025-10-04T07:12:19Z"
  },
  {
    "videoId": "OvKu0hKO6lQ",
    "title": "Beteluko Ermita 03/10/25",
    "publishedAt": "2025-10-03T10:42:50Z"
  },
  {
    "videoId": "RzUATQZVM1I",
    "title": "Aingeru Zaindariak - 02/10/25 (Lekunberri)",
    "publishedAt": "2025-10-02T17:33:48Z"
  },
  {
    "videoId": "kR8VVu3F7-4",
    "title": "Santa Teresita Lisieuxkoa. 01/10/25. (Lekunberri)",
    "publishedAt": "2025-10-01T17:34:53Z"
  },
  {
    "videoId": "aC9IrNI1Zto",
    "title": "San Jerónimo. 30/09/25.  Agustinas Aldatz",
    "publishedAt": "2025-09-30T10:42:37Z"
  },
  {
    "videoId": "cJAI7tRGFpY",
    "title": "Uitziko San Migelen egunsentia",
    "publishedAt": "2025-09-29T14:21:39Z"
  },
  {
    "videoId": "z1OMck6OAYc",
    "title": "Iglesia Navarra 20/03/2022",
    "publishedAt": "2022-06-08T13:31:21Z",
    "playlist": "Más videos"
  },
  {
    "videoId": "nK7LRvERTtw",
    "title": "Día del Seminario - Marzo 2024 Pamplona (IV)",
    "publishedAt": "2024-03-19T10:00:41Z"
  },
  {
    "videoId": "-JB5p9vxys4",
    "title": "Día del Seminario - Marzo 2024 Pamplona (III)",
    "publishedAt": "2024-03-17T10:00:00Z"
  },
  {
    "videoId": "vRyvp15ud0w",
    "title": "Día del Seminario - Marzo 2024 Pamplona (II)",
    "publishedAt": "2024-03-15T10:00:51Z"
  },
  {
    "videoId": "9EBorhB2W5w",
    "title": "Día del Seminario - Marzo 2024 Pamplona (I)",
    "publishedAt": "2024-03-13T10:00:09Z"
  },
  {
    "videoId": "3ec20-3Dv_s",
    "title": "El seminario es nuestra casa ¡y la de todos!",
    "publishedAt": "2023-03-10T23:00:10Z"
  },
  {
    "videoId": "uroYqWIaec4",
    "title": "Día del Seminario - 19 Marzo 2022 Pamplona (corto)",
    "publishedAt": "2022-03-20T08:57:42Z"
  },
  {
    "videoId": "6VBJGh9U-Rw",
    "title": "Día del seminario - 19 Marzo 2022 (extendido)",
    "publishedAt": "2022-03-18T23:00:28Z"
  },
  {
    "videoId": "lqpguDbasZY",
    "title": "SAN IÑAZIOREN MARTXA EUSKERAZ/ MARCHA DE SAN IGNACIO EN EUSKERA/ MARCH OF SAINT IGNATIUS IN BASQUE",
    "publishedAt": "2021-07-30T22:28:34Z",
    "playlist": " IMNOAK"
  },
  {
    "videoId": "OQsiy69baS8",
    "title": "HIMNO DE LA VIRGEN DEL PILAR [con letra]/ PILAREKO AMAREN IMNOA  (LEKUNBERRI)",
    "publishedAt": "2021-10-11T23:14:48Z",
    "playlist": " AMA BIRJINA"
  },
  {
    "videoId": "mEzIBR2cvOs",
    "title": "ARANTZAZUKO AMAREN IMNOA / HIMNO DE NUESTRA SEÑORA DE ARANZAZU",
    "publishedAt": "2021-09-11T07:35:16Z",
    "playlist": " AMA BIRJINA"
  },
  {
    "videoId": "s5F8sW6eanw",
    "title": "San Fko Xabierren Imnoa euskeraz eta erderaz/ Himno de san Fco  Javier en euskera y castellano",
    "publishedAt": "2021-12-03T00:04:20Z",
    "playlist": " IMNOAK"
  },
  {
    "videoId": "QsXFHFVYpzk",
    "title": "MIKEL GUREA GORDE EUSKALERRIA",
    "publishedAt": "2021-09-29T15:29:26Z",
    "playlist": " SAN MIGEL"
  },
  {
    "videoId": "4NBKRqyo7wQ",
    "title": "ORRIAKO AMA. ORREAGAKO AMAREN IMNOA/ HIMNO DE LA VIRGEN DE RONCESVALLES",
    "publishedAt": "2022-05-22T17:00:17Z",
    "playlist": " AMA BIRJINA"
  },
  {
    "videoId": "Vcc1HLHiBI8",
    "title": "FUI TROVADOR ME LLAMABAN FRANCISCO",
    "publishedAt": "2023-10-04T07:47:14Z",
    "playlist": " IMNOAK"
  },
  {
    "videoId": "GS5t4LnU6UI",
    "title": "AITA TXIT MAITE FRANTZISKO SANTUA (SAN FRANTZISKO XABIERRI KANTA) [ARRARATS]",
    "publishedAt": "2023-12-03T21:10:36Z",
    "playlist": " IMNOAK"
  },
  {
    "videoId": "7rUPKVW75n4",
    "title": "MANTXARIK GABE",
    "publishedAt": "2021-12-08T15:08:05Z",
    "playlist": " AMA BIRJINA"
  },
  {
    "videoId": "f9UroW86wr0",
    "title": "SANTA LUZIAREN BERTSOAK. ARRUITZ",
    "publishedAt": "2021-12-13T00:34:45Z",
    "playlist": " IMNOAK"
  },
  {
    "videoId": "ZWH3GgU875Y",
    "title": "GOIZUETAKO MADDALEN ERMITAKO BERTSOAK",
    "publishedAt": "2025-07-22T18:55:38Z",
    "playlist": " IMNOAK"
  },
  {
    "videoId": "SLAKDGDk3wg",
    "title": "HARTU AITA ZERUKOA",
    "publishedAt": "2023-11-05T19:13:13Z",
    "playlist": " OFERTORIOA"
  },
  {
    "videoId": "5SUPSnXulAQ",
    "title": "OGIA TA ARDOA",
    "publishedAt": "2025-02-09T13:00:31Z",
    "playlist": " OFERTORIOA"
  },
  {
    "videoId": "pvcizD6S2o0",
    "title": "ESKAINTZETAKO DANTZA/ DANÇA DO OFERTORIO. (HUAMBO-ANGOLA)",
    "publishedAt": "2023-11-20T11:04:04Z",
    "playlist": " OFERTORIOA"
  },
  {
    "videoId": "xzN7e0XJJSA",
    "title": "ESKEINTZEN DIZUT",
    "publishedAt": "2025-09-15T21:20:39Z",
    "playlist": " OFERTORIOA"
  },
  {
    "videoId": "uiGYNat7DAg",
    "title": "SAN MIGELEN AURORA (ORIXE) \"JONDONI MIKEL \"  UITZI.",
    "publishedAt": "2022-09-29T19:24:08Z",
    "playlist": " SAN MIGEL"
  },
  {
    "videoId": "66HWbGvQgtg",
    "title": "SAN MIGELEN LAPURRETAREN BERTSOAK",
    "publishedAt": "2022-04-24T19:29:25Z",
    "playlist": " SAN MIGEL"
  },
  {
    "videoId": "MXG37IC7yy0",
    "title": "AGUR MIKEL AINGERU",
    "publishedAt": "2025-04-27T17:39:31Z",
    "playlist": " SAN MIGEL"
  },
  {
    "videoId": "rEE65FbA5ME",
    "title": "O BIHOTZ GOZO JESUSENA",
    "publishedAt": "2022-06-05T17:38:21Z",
    "playlist": " JESUSEN BIHOTZA"
  },
  {
    "videoId": "b-3g8OtpGfw",
    "title": "BIHOTZ EDER BAT ARI DA SAGRARIOAN TAUPADAKA",
    "publishedAt": "2021-06-01T15:56:52Z",
    "playlist": " JESUSEN BIHOTZA"
  },
  {
    "videoId": "VaTilY3v33k",
    "title": "IZAN ZAITEZ BETI",
    "publishedAt": "2024-11-24T13:53:16Z",
    "playlist": " JESUSEN BIHOTZA"
  },
  {
    "videoId": "Q1leQ6nivRo",
    "title": "JESUS MAITE",
    "publishedAt": "2025-06-26T07:08:33Z",
    "playlist": " JESUSEN BIHOTZA"
  },
  {
    "videoId": "lcCBqp5IQEw",
    "title": "KRISTORENAK GERA",
    "publishedAt": "2025-07-02T06:41:11Z",
    "playlist": " JESUSEN BIHOTZA"
  },
  {
    "videoId": "WJOkYyjCqDk",
    "title": "IZAN ZAITEZ BETI",
    "publishedAt": "2025-07-06T17:40:41Z",
    "playlist": " JESUSEN BIHOTZA"
  },
  {
    "videoId": "eiZa7oKNzdc",
    "title": "NERE AMA TXIT LAZTANA",
    "publishedAt": "2022-03-15T18:51:15Z",
    "playlist": " AMA BIRJINA"
  },
  {
    "videoId": "soTnlvBQblM",
    "title": "MAITE ZAITUGUN AMA BIRJINA MARIA",
    "publishedAt": "2021-11-25T19:50:36Z",
    "playlist": " AMA BIRJINA"
  },
  {
    "videoId": "2IAanYR-GP4",
    "title": "POZEZ BETERIK GOAZEN MARIARENGANA/ MAIATZEKO LOREAK. ARANO",
    "publishedAt": "2022-05-15T15:31:41Z",
    "playlist": " AMA BIRJINA"
  },
  {
    "videoId": "F-K8YTFHUk0",
    "title": "POZIK IKUSTEN ZAITUGU ZERURA ZOAZELA",
    "publishedAt": "2022-08-14T13:16:18Z",
    "playlist": " AMA BIRJINA"
  },
  {
    "videoId": "r7AuJDuINOI",
    "title": "AGUR MARIA GURE POZA",
    "publishedAt": "2022-02-16T19:02:22Z",
    "playlist": " AMA BIRJINA"
  },
  {
    "videoId": "eDDOa-8RpzA",
    "title": "ANGELUSA EUSKERAZ.  \"AINGERU BATEK MARIARI\"",
    "publishedAt": "2022-10-16T13:23:24Z",
    "playlist": " AMA BIRJINA"
  },
  {
    "videoId": "sL3zUA4y-vY",
    "title": "ZURE BIHOTZAK AMA MAITE",
    "publishedAt": "2022-07-16T12:06:32Z",
    "playlist": " HILETAK"
  },
  {
    "videoId": "cYH3pr-lvkI",
    "title": "GOAZEN, GOAZEN GUZTIOK/ MAIATZEKO LOREAK/ AINGERUTXOAK. ARESO",
    "publishedAt": "2022-05-08T13:17:32Z",
    "playlist": " AMA BIRJINA"
  },
  {
    "videoId": "QE8A3lhygmY",
    "title": "AMA MAITE MARIA",
    "publishedAt": "2022-01-25T18:41:00Z",
    "playlist": " AMA BIRJINA"
  },
  {
    "videoId": "W0PbRzsxue0",
    "title": "ZERU LURREN ERREGINA (REGINA COELI EUSKERAZ)",
    "publishedAt": "2023-09-10T21:02:34Z",
    "playlist": " PAZKOA"
  },
  {
    "videoId": "en6PgSsfwPs",
    "title": "BIZI DEDILA ERROSARIOA",
    "publishedAt": "2023-10-07T10:49:39Z",
    "playlist": " AMA BIRJINA"
  },
  {
    "videoId": "VCxIxn6aUcg",
    "title": "AINGERUAK MARIARI DIO GRAZIZ BETEA",
    "publishedAt": "2023-10-28T13:37:42Z",
    "playlist": " AMA BIRJINA"
  },
  {
    "videoId": "iWvKnmazKPU",
    "title": "AGUR JESUSEN AMA",
    "publishedAt": "2023-12-08T20:48:16Z",
    "playlist": " AMA BIRJINA"
  },
  {
    "videoId": "ESJXWBS38DM",
    "title": "NERE AMA TXIT LAZTANA II (BESTE DOINU BATEKIN)",
    "publishedAt": "2024-01-02T10:21:32Z",
    "playlist": " AMA BIRJINA"
  },
  {
    "videoId": "WMG1oki1g-w",
    "title": "JAINKOAREN AMA",
    "publishedAt": "2024-01-14T17:29:36Z",
    "playlist": " AMA BIRJINA"
  },
  {
    "videoId": "yNYpce0fDic",
    "title": "AGUR AMA ERRUKIZ BETEA",
    "publishedAt": "2024-06-09T18:32:19Z",
    "playlist": " AMA BIRJINA"
  },
  {
    "videoId": "l01JTwIiimY",
    "title": "AMA MARIARI",
    "publishedAt": "2024-11-10T18:27:19Z",
    "playlist": " AMA BIRJINA"
  },
  {
    "videoId": "zdKxTaw1w9w",
    "title": "EGIZU ZUK MARIA",
    "publishedAt": "2023-03-19T15:36:22Z",
    "playlist": " AMA BIRJINA"
  },
  {
    "videoId": "r3vynDmzxcY",
    "title": "MARIA GURE AMA",
    "publishedAt": "2025-03-02T11:13:23Z",
    "playlist": " AMA BIRJINA"
  },
  {
    "videoId": "kh0ucTq3KiI",
    "title": "SALBEA 2025. DONOSTIA",
    "publishedAt": "2025-08-14T18:26:05Z",
    "playlist": " AMA BIRJINA"
  },
  {
    "videoId": "RwpE488kiSg",
    "title": "HILDAKO GUZTIEN ALDEKO ERRESPONSOA (GUGATIK HIL ZINENA)",
    "publishedAt": "2021-11-02T11:40:02Z",
    "playlist": " HILETAK"
  },
  {
    "videoId": "ff-AOqoBPE8",
    "title": "AGUR JAUNAK",
    "publishedAt": "2021-11-18T08:32:13Z",
    "playlist": " HILETAK"
  },
  {
    "videoId": "heCjTNdp7P8",
    "title": "ZURE ETXERA GOAZ JAUNA",
    "publishedAt": "2022-11-02T10:14:22Z",
    "playlist": " HILETAK"
  },
  {
    "videoId": "h3LAHitCLAs",
    "title": "SAR ZAITEZ ARREN (SIGNORE DELLE CIME EUSKERAZ)",
    "publishedAt": "2023-08-27T16:29:30Z",
    "playlist": " SARRERA"
  },
  {
    "videoId": "pXh9V9WtNAg",
    "title": "LIBERA ME DOMINE (PEROSI) GURE HERRIETAKO HILDAKO GUZTIEN ALDE",
    "publishedAt": "2023-11-01T18:27:17Z",
    "playlist": " HILETAK"
  },
  {
    "videoId": "bBtpUlVL2Cs",
    "title": "ZABAL DEIOLA JAUNAK ZERUKO ATEA",
    "publishedAt": "2024-11-02T08:15:30Z",
    "playlist": " HILETAK"
  },
  {
    "videoId": "1epxvctIagg",
    "title": "BETI BETIKO ZORIONA",
    "publishedAt": "2025-03-26T08:02:21Z",
    "playlist": " HILETAK"
  },
  {
    "videoId": "avHEV8yY9RE",
    "title": "PIZTU ZAIGU GURE JAUNA",
    "publishedAt": "2024-11-17T16:39:24Z",
    "playlist": " PAZKOA"
  },
  {
    "videoId": "4bh-i8D7ZxU",
    "title": "PAZKOA ABESTEN DEGU",
    "publishedAt": "2021-04-03T20:52:27Z",
    "playlist": " PAZKOA"
  },
  {
    "videoId": "fVMJBJzroqI",
    "title": "GUREKIN EGON",
    "publishedAt": "2023-04-09T19:11:58Z",
    "playlist": " JAUNARTZEA"
  },
  {
    "videoId": "E_WNawdc8bk",
    "title": "KRISTO JAUNA PIZTU DA",
    "publishedAt": "2024-03-31T12:44:28Z",
    "playlist": " PAZKOA"
  },
  {
    "videoId": "9ybQuVuWKEk",
    "title": "HAU DA EGUNA, JAUNARENA",
    "publishedAt": "2024-04-22T19:24:15Z",
    "playlist": " PAZKOA"
  },
  {
    "videoId": "2A4MP1T56pk",
    "title": "ZUK EMAN JAUNA ARNAS BERRI",
    "publishedAt": "2023-04-02T13:53:56Z",
    "playlist": " GARIZUMA"
  },
  {
    "videoId": "0H7GXR1AnQI",
    "title": "JAUNA ZUGANA GATOZ",
    "publishedAt": "2023-03-26T16:57:45Z",
    "playlist": " GARIZUMA"
  },
  {
    "videoId": "n3uRHqo__PY",
    "title": "JESUS GURE JAUN MAITE AMODIOTSUA",
    "publishedAt": "2022-03-23T11:18:56Z",
    "playlist": " GARIZUMA"
  },
  {
    "videoId": "gvkEe915MYg",
    "title": "BIHOTZ GARBIA GUGAN SORTU",
    "publishedAt": "2021-12-23T14:02:41Z",
    "playlist": " SARRERA"
  },
  {
    "videoId": "UN7Y5TdbBX0",
    "title": "ATOZ PEKATARIA",
    "publishedAt": "2022-03-11T16:48:57Z",
    "playlist": " GARIZUMA"
  },
  {
    "videoId": "7y8wB-P4pow",
    "title": "DAMU DET JAUNA",
    "publishedAt": "2022-03-22T06:08:53Z",
    "playlist": " GARIZUMA"
  },
  {
    "videoId": "sdD6WOExRHQ",
    "title": "ZU ZERA GURE POZA",
    "publishedAt": "2024-09-15T17:46:13Z",
    "playlist": " GARIZUMA"
  },
  {
    "videoId": "hz76E4x4bfU",
    "title": "ENTZUN JAINKO ERRUKIORRA",
    "publishedAt": "2025-04-13T16:21:19Z",
    "playlist": " GARIZUMA"
  },
  {
    "videoId": "juPgpHxB-nA",
    "title": "AGURTZEN ZAITUT KRISTO",
    "publishedAt": "2025-04-18T19:40:11Z",
    "playlist": " GARIZUMA"
  },
  {
    "videoId": "E2CYyWVIAqM",
    "title": "MENDIALDETIK DATOZ ARTZAIAK (KANTA ALLELUIA)",
    "publishedAt": "2021-12-27T22:15:06Z",
    "playlist": " EGUBERRIALDIA"
  },
  {
    "videoId": "OuFJD11lIwE",
    "title": "ADESTE FIDELES EUSKERAZ ( ZATOZTE KRISTAUAK)",
    "publishedAt": "2023-01-03T20:17:51Z",
    "playlist": " EGUBERRIALDIA"
  },
  {
    "videoId": "JvPNmmQoSf0",
    "title": "GABEKO IZAR ARGITSUENA",
    "publishedAt": "2022-01-03T22:14:29Z",
    "playlist": " EGUBERRIALDIA"
  },
  {
    "videoId": "xczA56ET_6M",
    "title": "HAURTXO MAITE",
    "publishedAt": "2022-01-01T09:58:17Z",
    "playlist": " EGUBERRIALDIA"
  },
  {
    "videoId": "ig8N9dsYifk",
    "title": "OI BETHLEEM",
    "publishedAt": "2023-12-25T20:11:27Z",
    "playlist": " EGUBERRIALDIA"
  },
  {
    "videoId": "gcdB3ETr5k4",
    "title": "HAUR TXIKI EDER POLIT BAT",
    "publishedAt": "2024-01-06T20:35:41Z",
    "playlist": " EGUBERRIALDIA"
  },
  {
    "videoId": "monWpBEQeVo",
    "title": "MESIAS SARRITAN AGINDU ZANA",
    "publishedAt": "2024-12-25T19:42:18Z",
    "playlist": " EGUBERRIALDIA"
  },
  {
    "videoId": "0KSz7thyDv8",
    "title": "ELURRA MARA-MARA",
    "publishedAt": "2025-01-12T13:50:25Z",
    "playlist": " EGUBERRIALDIA"
  },
  {
    "videoId": "XJjOOvlTuzk",
    "title": "ZATOZ JAUNA, ZATOZ LURRERA",
    "publishedAt": "2022-12-04T17:07:13Z",
    "playlist": " SARRERA"
  },
  {
    "videoId": "Y_ShpVGInH4",
    "title": "SALBA GAITZAZU ATOZ JAUNA",
    "publishedAt": "2024-12-01T16:01:05Z",
    "playlist": " ABENDUALDIA"
  },
  {
    "videoId": "chhEfDipu84",
    "title": "JAUN ONA MUNDUA SALBATZERA ETORRI GUGANA ZERUTIK",
    "publishedAt": "2024-12-22T17:13:46Z",
    "playlist": " ABENDUALDIA"
  },
  {
    "videoId": "XVXYrHfGvJk",
    "title": "JAUNGOIKOA NAHI DUGU DENOK LARRAUNGO HERRI HONTAN",
    "publishedAt": "2022-10-09T13:55:22Z",
    "playlist": " IRTEERA"
  },
  {
    "videoId": "5WXd3NU8VQQ",
    "title": "ESKERRIK ASKO JAUNA",
    "publishedAt": "2023-12-28T15:38:22Z",
    "playlist": " IRTEERA"
  },
  {
    "videoId": "6NyQSDyfX60",
    "title": "ATOZ JESUS GUZTIZ ONA NEREGANA",
    "publishedAt": "2023-07-23T14:04:51Z",
    "playlist": " JAUNARTZEA"
  },
  {
    "videoId": "fwvHhLQyHMY",
    "title": "HOR ZAUDE JESUS",
    "publishedAt": "2022-11-13T18:11:32Z",
    "playlist": " JAUNARTZEA"
  },
  {
    "videoId": "lu1XY39dZtc",
    "title": "HONA BILDOTS EZTIA",
    "publishedAt": "2023-04-30T13:54:09Z",
    "playlist": " JAUNARTZEA"
  },
  {
    "videoId": "ORt3ae9udL8",
    "title": "OGI ZERUTIK ETORRIA",
    "publishedAt": "2023-06-11T18:07:35Z",
    "playlist": " JAUNARTZEA"
  },
  {
    "videoId": "0_QLMWltiiI",
    "title": "AGUR HOSTI LEUN TA GARBI",
    "publishedAt": "2022-02-17T20:29:12Z",
    "playlist": " JAUNARTZEA"
  },
  {
    "videoId": "AXGrIGLkmZA",
    "title": "AFALONDOAN XUTITU ZEN JESUS",
    "publishedAt": "2022-04-14T08:30:57Z",
    "playlist": " JAUNARTZEA"
  },
  {
    "videoId": "gsdIRxjZl2I",
    "title": "GURE ONDOAN JAUNA EGON ZAITEZ BETI",
    "publishedAt": "2022-02-09T10:51:11Z",
    "playlist": " JAUNARTZEA"
  },
  {
    "videoId": "smCodkVGeW8",
    "title": "ZER ZORION",
    "publishedAt": "2021-12-16T11:28:25Z",
    "playlist": " JAUNARTZEA"
  },
  {
    "videoId": "Y1uCXZgLHtc",
    "title": "AZKEN AFARI EZKEROZ JAUNA",
    "publishedAt": "2024-07-07T16:26:47Z",
    "playlist": " JAUNARTZEA"
  },
  {
    "videoId": "3dDNRgdBWLo",
    "title": "HOSTIAN BIZI ZERA",
    "publishedAt": "2025-02-23T19:08:56Z",
    "playlist": " JAUNARTZEA"
  },
  {
    "videoId": "U4G7E6lJrqA",
    "title": "JESUS MAITEA ZAN",
    "publishedAt": "2025-03-09T12:15:37Z",
    "playlist": " JAUNARTZEA"
  },
  {
    "videoId": "xDic_VRWjvE",
    "title": "NIRE ONDOAN",
    "publishedAt": "2025-05-18T15:41:21Z",
    "playlist": " JAUNARTZEA"
  },
  {
    "videoId": "rAbESJlkwdw",
    "title": "POZ POZIK NATORKIZU JESUS",
    "publishedAt": "2021-07-06T14:30:47Z",
    "playlist": " JAUNARTZEA"
  },
  {
    "videoId": "dZo5aoAwfZY",
    "title": "MAITASUNA BAKEAREKIN BATERA (KAXIANO)",
    "publishedAt": "2023-02-05T18:31:43Z",
    "playlist": " BAKEA"
  },
  {
    "videoId": "31XIS13GNGs",
    "title": "ARRENKA ESKA GAUDE BAKEA",
    "publishedAt": "2025-07-27T18:22:55Z",
    "playlist": " BAKEA"
  },
  {
    "videoId": "cr5fvAFBzmY",
    "title": "BAKEA ZUENTZAT",
    "publishedAt": "2025-09-16T21:16:05Z",
    "playlist": " BAKEA"
  },
  {
    "videoId": "oAzhxtWDKik",
    "title": "SANCTUS EUSKERAZ V",
    "publishedAt": "2022-12-11T17:09:08Z",
    "playlist": " SANCTUS"
  },
  {
    "videoId": "nSQ7G1zH1J0",
    "title": "SANCTUS EUSKERAZ III (KLASIKOA)",
    "publishedAt": "2022-10-23T17:20:54Z",
    "playlist": " SANCTUS"
  },
  {
    "videoId": "4Zkivj4xmLM",
    "title": "SANCTUS EUSKERAZ VII (DIREN GUZTIEN JAINKO JAUNA)",
    "publishedAt": "2023-02-19T16:46:16Z",
    "playlist": " SANCTUS"
  },
  {
    "videoId": "xXHMZSSYNHE",
    "title": "SANCTUS EUSKERAZ VI (IZADIAREN JAUNA)",
    "publishedAt": "2023-01-15T17:35:04Z",
    "playlist": " SANCTUS"
  },
  {
    "videoId": "zfLzvRE_Hmo",
    "title": "SANCTUS EUSKERAZ VIII (SALAMANKARA)",
    "publishedAt": "2023-07-20T15:59:36Z",
    "playlist": " SANCTUS"
  },
  {
    "videoId": "IRgUKcM8Y_c",
    "title": "SANCTUS EUSKARAZ IV. SANTU, SANTU, SANTUA.",
    "publishedAt": "2022-10-30T15:58:33Z",
    "playlist": " SANCTUS"
  },
  {
    "videoId": "QQK566Y-bh4",
    "title": "SANCTUS EUSKERAZ II (SANTU, SANTU, SANTUA)",
    "publishedAt": "2022-08-21T13:50:20Z",
    "playlist": " SANCTUS"
  },
  {
    "videoId": "-0Quvy1r_2c",
    "title": "SANCTUS EUSKERAZ I (KANTA DEZAGUN AINGERUEKIN)",
    "publishedAt": "2022-04-09T14:50:57Z",
    "playlist": " SANCTUS"
  },
  {
    "videoId": "4bJPZI-Vj44",
    "title": "SANCTUS EUSKERAZ IX (SANTU SANTUA)",
    "publishedAt": "2024-09-29T15:10:25Z",
    "playlist": " SANCTUS"
  },
  {
    "videoId": "aZ1LnHsshSQ",
    "title": "SANCTUS EUSKERAZ X (HOSANNA HOSANNA ZERU GOIENETAN)",
    "publishedAt": "2024-10-13T15:10:15Z",
    "playlist": " SANCTUS"
  },
  {
    "videoId": "5sFacIC2Zvk",
    "title": "SANCTUS EUSKERAZ XI (HOSANNA GORA)",
    "publishedAt": "2025-03-04T17:52:04Z",
    "playlist": " SANCTUS"
  },
  {
    "videoId": "szWIvtdulw8",
    "title": "BERTAN DAGO JAUNA",
    "publishedAt": "2023-07-16T14:06:29Z",
    "playlist": " SALMOAK"
  },
  {
    "videoId": "r7pU7tL3MjQ",
    "title": "JAUNA ZURE MAITASUNA ABESTUKO DUT BETIREN BETI",
    "publishedAt": "2023-01-29T15:39:29Z",
    "playlist": " SALMOAK"
  },
  {
    "videoId": "Zs7Eqzu_f2k",
    "title": "ZURE HITZA",
    "publishedAt": "2023-02-26T18:42:47Z",
    "playlist": " SALMOAK"
  },
  {
    "videoId": "CD6NmRsOkwU",
    "title": "JAUNA DUT ARTZAI",
    "publishedAt": "2022-11-07T12:48:46Z",
    "playlist": " SALMOAK"
  },
  {
    "videoId": "Q4Wm9DggDgM",
    "title": "ALLELUIA/AINTZA JAUNA",
    "publishedAt": "2023-05-28T17:07:13Z",
    "playlist": " SALMOAK"
  },
  {
    "videoId": "BFnkYKEqlV4",
    "title": "LUR OSOA EGIOZU IRRINTZI JAINKOARI",
    "publishedAt": "2023-09-30T17:27:37Z",
    "playlist": " SALMOAK"
  },
  {
    "videoId": "9OCFqh09mw8",
    "title": "GLORIA PASTORELA. ERREGE EGUNEKO MEZA NAGUSIAN. LEITZA",
    "publishedAt": "2023-01-06T22:01:31Z",
    "playlist": " AINTZA"
  },
  {
    "videoId": "QTtW-VC3gPM",
    "title": "AINTZA ZERUAN JAUNARI",
    "publishedAt": "2022-02-06T17:58:15Z",
    "playlist": " AINTZA"
  },
  {
    "videoId": "aT6W3yM90nw",
    "title": "AINTZA ZERUETAN JAINKOARI",
    "publishedAt": "2023-06-23T17:36:07Z",
    "playlist": " AINTZA"
  },
  {
    "videoId": "0q0fdGvCOCI",
    "title": "AINTZA ZURI JAUNA (KLASIKOA)",
    "publishedAt": "2023-08-08T17:02:41Z",
    "playlist": " AINTZA"
  },
  {
    "videoId": "2_RB5qacqbE",
    "title": "GLORIA (REFICE) SAN SEBASTIAN EGUNA 2025",
    "publishedAt": "2025-01-20T14:05:14Z",
    "playlist": " AINTZA"
  },
  {
    "videoId": "r46GDOdzcgA",
    "title": "GLORIA (BATTMANN) EGUBERRI EGUNA 2024",
    "publishedAt": "2024-12-25T21:25:57Z",
    "playlist": " AINTZA"
  },
  {
    "videoId": "k6tePDC0V-s",
    "title": "BIHOTZ BATEZ ELKARTURIK",
    "publishedAt": "2022-09-11T20:23:42Z",
    "playlist": " SARRERA"
  },
  {
    "videoId": "CdEZj9J52RM",
    "title": "ZEIN GOZO TA EDER DEN",
    "publishedAt": "2022-10-02T17:26:34Z",
    "playlist": " SARRERA"
  },
  {
    "videoId": "K_rZ7mpMscA",
    "title": "KRISTOREKIN GUK FEDE BERA,  BATAIO BERA, BERA JAINKOA",
    "publishedAt": "2022-01-09T13:54:15Z",
    "playlist": " SARRERA"
  },
  {
    "videoId": "vV9Mnkwoelw",
    "title": "KRISTO GURE ERREGE",
    "publishedAt": "2022-11-20T13:39:17Z",
    "playlist": " SARRERA"
  },
  {
    "videoId": "GjHDwdsRtSM",
    "title": "JESUS MUNDUKO ARGIA",
    "publishedAt": "2024-02-11T17:44:39Z",
    "playlist": " SARRERA"
  },
  {
    "videoId": "TzR_kVWAfGo",
    "title": "ZURE HITZA ENTZUTERA",
    "publishedAt": "2024-08-02T06:33:41Z",
    "playlist": " SARRERA"
  },
  {
    "videoId": "GpQm05GjVBg",
    "title": "ZABAL BIHOTZOK ERRUKIRAKO",
    "publishedAt": "2025-01-13T13:58:07Z",
    "playlist": " SARRERA"
  },
  {
    "videoId": "0bS9VY8N5ZE",
    "title": "GOAZEN GUZTIOK JAINKOARENGANA",
    "publishedAt": "2025-02-16T18:20:25Z",
    "playlist": " SARRERA"
  },
  {
    "videoId": "E9KYktjF3hg",
    "title": "GOAZEN ELKARTURIK",
    "publishedAt": "2025-07-13T16:05:47Z",
    "playlist": " SARRERA"
  },
  {
    "videoId": "W1QVdV0Q-go",
    "title": "IGANDETAN ELIZAN",
    "publishedAt": "2025-09-07T19:59:16Z",
    "playlist": " SARRERA"
  },
  {
    "videoId": "0yLskVkJp98",
    "title": "EGUBERRI EGUNA 2025",
    "publishedAt": "2025-12-25T12:45:15Z"
  },
  {
    "videoId": "kY4PgHZVnAs",
    "title": "LEITZAKO DESPEDIDA",
    "publishedAt": "2025-09-29T10:47:36Z"
  },
  {
    "videoId": "ETCgv9aNmBg",
    "title": "UZko XXVI. IGANDEA/ DESPEDIDA (ARESO)",
    "publishedAt": "2025-09-28T12:02:22Z"
  },
  {
    "videoId": "K430rol23tI",
    "title": "GURUTZE SANTUAREN MEZA (INTZA)",
    "publishedAt": "2025-09-27T18:54:27Z"
  },
  {
    "videoId": "qNpwdyd1cPU",
    "title": "UZko XXV. OSTIRALA (BETELU)",
    "publishedAt": "2025-09-26T16:02:37Z"
  },
  {
    "videoId": "NRSW_hSKQ-4",
    "title": "HILETA (ALDATZ",
    "publishedAt": "2025-09-25T21:06:36Z"
  },
  {
    "videoId": "lhtRyGHOQeE",
    "title": "UZko XXV. ASTEAZKENA (LEITZA)",
    "publishedAt": "2025-09-24T18:57:44Z"
  },
  {
    "videoId": "IQahFgOJW3U",
    "title": "ARALAR IRRATIAN (2025-IX-23). DESPEDIDA",
    "publishedAt": "2025-09-24T05:58:54Z"
  },
  {
    "videoId": "jEHxRXJFPi4",
    "title": "SAN PIO PIETRELCINAKOA (LEKUNBERRI)",
    "publishedAt": "2025-09-23T18:28:09Z"
  },
  {
    "videoId": "15u8tEyupkU",
    "title": "UZko XXV. ASTELEHENA (LEITZA)",
    "publishedAt": "2025-09-22T21:32:08Z"
  },
  {
    "videoId": "lzKZMOyvRcg",
    "title": "UZko XXV. IGANDEA (IGOA)",
    "publishedAt": "2025-09-21T15:45:28Z"
  },
  {
    "videoId": "vK94rMPH3z0",
    "title": "HILETA (ODERITZ)",
    "publishedAt": "2025-09-20T17:38:08Z"
  },
  {
    "videoId": "bmIP1aoeB40",
    "title": "BEDEINKATUA ZU",
    "publishedAt": "2025-09-19T17:00:08Z"
  },
  {
    "videoId": "oEIjt38BjtM",
    "title": "JESUSEN BIHOTZAREN DEBOZIOZKO MEZA",
    "publishedAt": "2025-09-18T15:05:16Z"
  },
  {
    "videoId": "ATjaipDA17c",
    "title": "SAN ROBERTO BELARMINO",
    "publishedAt": "2025-09-17T07:54:34Z"
  },
  {
    "videoId": "C1qBjRwGHTY",
    "title": "GURUTZE SANTUAREN GORALPENA (ARANO)",
    "publishedAt": "2025-09-14T09:48:21Z"
  },
  {
    "videoId": "3b-EEU1uVnM",
    "title": "GURUTZE SANTUAREN MEZA ETA GURUTZ BIDEA (LEITZA)",
    "publishedAt": "2025-09-13T09:41:46Z"
  },
  {
    "videoId": "wk3-RZk5Nvc",
    "title": "UZk9 XXIII. OSTIRALA (BETELU)",
    "publishedAt": "2025-09-12T10:50:17Z"
  },
  {
    "videoId": "8vb0MNZu-ZE",
    "title": "JUEVES XXIII. DEL TO (AGUSTINAS ALDATZ",
    "publishedAt": "2025-09-11T10:57:13Z"
  },
  {
    "videoId": "FNbPCgkRIO4",
    "title": "UZko XXIII. ASTEAZKENA (LEITZA)",
    "publishedAt": "2025-09-10T18:27:00Z"
  },
  {
    "videoId": "KLodV4GaRmA",
    "title": "ARANTZAZUKO AMA 2025 (GORRIZTARAN)",
    "publishedAt": "2025-09-09T18:28:51Z"
  },
  {
    "videoId": "lL8Wk7YCA8U",
    "title": "AMA BIRJINAREN JAIOTZA 2025 (GOLDARATZ)",
    "publishedAt": "2025-09-08T14:25:06Z"
  },
  {
    "videoId": "WixSo85JwtU",
    "title": "GURUTZEEN EGUNA 2025 (SAN MIGEL)",
    "publishedAt": "2025-09-07T16:37:47Z"
  },
  {
    "videoId": "2UgTu6YO6tY",
    "title": "MISA VOTIVA DE SANTA MARIA (AGUSTINAS ALDATZ)",
    "publishedAt": "2025-09-06T08:11:48Z"
  },
  {
    "videoId": "CZPh0Qhm5HA",
    "title": "UZko XXII. OSTIRALA (LEKUNBERRI)",
    "publishedAt": "2025-09-05T17:32:51Z"
  },
  {
    "videoId": "T1Uxzcn1doA",
    "title": "KONTSOLAMENDUAREN AMA (GOLDARATZ)",
    "publishedAt": "2025-09-04T14:13:17Z"
  },
  {
    "videoId": "d7I7zmW_UYw",
    "title": "SAN GREGORIO MAGNO (LEKUNBERRI)",
    "publishedAt": "2025-09-03T18:09:14Z"
  },
  {
    "videoId": "SWhWtrPUb7E",
    "title": "MARTES XXII. del T.O. (AGUSTINAS ALDATZ)",
    "publishedAt": "2025-09-02T17:12:50Z"
  },
  {
    "videoId": "pnSBNv4N-CM",
    "title": "UZko XXII. ASTELEHENA (LEKUNBERRI)",
    "publishedAt": "2025-09-01T17:55:37Z"
  },
  {
    "videoId": "Ft-s_jJ1q1w",
    "title": "UZko XXII. IGANDEA (ETXALEKU)",
    "publishedAt": "2025-08-31T09:03:44Z"
  },
  {
    "videoId": "2TwfY6rWKNs",
    "title": "GURUTZEEN EGUNA 2025 ETA MEZUA GAZATIK/ DÍA DE LAS CRUCES Y MENSAJE DESDE GAZA",
    "publishedAt": "2025-08-30T11:01:19Z"
  },
  {
    "videoId": "bX5MPYpYrMg",
    "title": "SAN JOAN BATAIATZAILEAREN MARTIRITZA 2025 (ATALLU)",
    "publishedAt": "2025-08-29T13:31:18Z"
  },
  {
    "videoId": "0KRU2ftGKqg",
    "title": "SAN AGUSTIN 2025 (ARTIKUTZA)",
    "publishedAt": "2025-08-28T14:58:41Z"
  },
  {
    "videoId": "8R4z2_55j34",
    "title": "2025(e)ko abuztuakren 27(a)",
    "publishedAt": "2025-08-27T10:00:12Z"
  },
  {
    "videoId": "Tt2uIaTyZps",
    "title": "HILETA (LEITZA)",
    "publishedAt": "2025-08-26T07:00:25Z"
  },
  {
    "videoId": "bNP50F11BOs",
    "title": "HILETA (BETELU)",
    "publishedAt": "2025-08-25T07:00:29Z"
  },
  {
    "videoId": "4D5nyeGOXI0",
    "title": "SAN BARTOLOME 2025 (GORRITI)",
    "publishedAt": "2025-08-24T13:25:19Z"
  },
  {
    "videoId": "CIuBVYdgNE0",
    "title": "DOMINGO XXI. del T.O. (URRITZA)",
    "publishedAt": "2025-08-23T16:22:39Z"
  },
  {
    "videoId": "EwuhqqBcaHo",
    "title": "MARIA ERREGINA (BETELU)",
    "publishedAt": "2025-08-22T11:00:45Z"
  },
  {
    "videoId": "0bwXAblX4ak",
    "title": "HILETA (LEKUNBERRI)",
    "publishedAt": "2025-08-21T07:59:16Z"
  },
  {
    "videoId": "CDXhHP0U-KY",
    "title": "SAN BERNARDO (LEKUNBERRI)",
    "publishedAt": "2025-08-20T17:57:45Z"
  },
  {
    "videoId": "kk1Kf8S8e3Q",
    "title": "UZko XX. ASTEARTEA (LEKUNBERRI)",
    "publishedAt": "2025-08-19T18:00:57Z"
  },
  {
    "videoId": "X3oELBtTGTQ",
    "title": "HILETA (LEITZA)",
    "publishedAt": "2025-08-19T08:29:12Z"
  },
  {
    "videoId": "7NkpBjSs1NY",
    "title": "HILETA (BETELU)",
    "publishedAt": "2025-08-18T11:07:39Z"
  },
  {
    "videoId": "XmR3i0NzaOo",
    "title": "UZko XX. IGANDEA (LEITZA)",
    "publishedAt": "2025-08-17T12:05:42Z"
  },
  {
    "videoId": "CZ1wrC2XuPY",
    "title": "SAN ROKE 2025 (ARANO)",
    "publishedAt": "2025-08-16T12:22:05Z"
  },
  {
    "videoId": "jFB2X00bMVQ",
    "title": "AMA BIRJINAREN ZERURATZEA 2025 (ARESO)",
    "publishedAt": "2025-08-15T11:52:36Z"
  },
  {
    "videoId": "Z1vFQNN5Jz8",
    "title": "HILETA (BETELU)",
    "publishedAt": "2025-08-14T09:59:40Z"
  },
  {
    "videoId": "oAOB0znHC7o",
    "title": "HILETA (ARANO)",
    "publishedAt": "2025-08-13T19:00:29Z"
  },
  {
    "videoId": "zPybJs3-J10",
    "title": "HILETA (IGOA)",
    "publishedAt": "2025-08-12T16:06:41Z"
  },
  {
    "videoId": "zjzffyoNPXY",
    "title": "SAN TIBURTZIO 2025 (LEITZA)",
    "publishedAt": "2025-08-11T16:42:53Z"
  },
  {
    "videoId": "MBSbNLytZKk",
    "title": "BERRI BAT",
    "publishedAt": "2025-08-10T23:27:57Z"
  },
  {
    "videoId": "KHnJp2kTX0A",
    "title": "SAN LORENTZO 2025 (ALBIASU)",
    "publishedAt": "2025-08-10T11:50:45Z"
  },
  {
    "videoId": "NWF7WpCCkMQ",
    "title": "UZk9 XIX. IGANDEA (ERASO)",
    "publishedAt": "2025-08-09T17:36:37Z"
  },
  {
    "videoId": "mSExwx1iqSg",
    "title": "SANTO DOMINGO GUZMANGOA (BETELU)",
    "publishedAt": "2025-08-08T12:46:44Z"
  },
  {
    "videoId": "zHhGQcUgbA4",
    "title": "MISA EXEQUIAL (GOLDARATZ)",
    "publishedAt": "2025-08-07T15:46:25Z"
  },
  {
    "videoId": "CyB50MF1Tps",
    "title": "JAUNAREN ANTZALDATZEA 2025 (ERRAZKIN)",
    "publishedAt": "2025-08-06T17:25:34Z"
  },
  {
    "videoId": "n6KnH2GtMno",
    "title": "HILETA (GOIZUETA)",
    "publishedAt": "2025-08-05T04:20:02Z"
  },
  {
    "videoId": "24nxhfoKwJo",
    "title": "HILETA (GORRITI)",
    "publishedAt": "2025-08-04T08:49:44Z"
  },
  {
    "videoId": "2VNyAt2vjO4",
    "title": "DOMINGO XVIII. DEL T.O.",
    "publishedAt": "2025-08-03T09:55:10Z"
  },
  {
    "videoId": "_tQ_fpBFIlA",
    "title": "HILETA (LEKUNBERRI)",
    "publishedAt": "2025-08-02T08:00:44Z"
  },
  {
    "videoId": "o16hfDxQbVk",
    "title": "SAN ALFONSO MARIA LIGORIO",
    "publishedAt": "2025-08-01T13:31:23Z"
  },
  {
    "videoId": "q_peLbeKqjY",
    "title": "LOIOLAKO SAN IÑAZIO 2025",
    "publishedAt": "2025-07-31T14:39:19Z"
  },
  {
    "videoId": "c8f-sPX32bk",
    "title": "MIERCOLES XVII DEL T.O. (AGUSTINAS ALDATZ)",
    "publishedAt": "2025-07-30T09:42:43Z"
  },
  {
    "videoId": "KUVJ3Ez6Ktg",
    "title": "HILETA (ITSASO)",
    "publishedAt": "2025-07-29T17:01:39Z"
  },
  {
    "videoId": "QvYG34KqG4c",
    "title": "HILETA (IGOA)",
    "publishedAt": "2025-07-28T08:58:59Z"
  },
  {
    "videoId": "RC0dBPaD_QA",
    "title": "UZko XVII. IGANDEA (ARANO)",
    "publishedAt": "2025-07-27T11:32:06Z"
  },
  {
    "videoId": "6G1VBDVjfGQ",
    "title": "SAN JOAQUIN Y SANTA ANA (AGUSTINAS ALDATZ)",
    "publishedAt": "2025-07-26T07:56:53Z"
  },
  {
    "videoId": "ZMDShhzSOjk",
    "title": "SANTIAGO 2025 (ARANO)",
    "publishedAt": "2025-07-25T10:41:46Z"
  },
  {
    "videoId": "iX5xdXlPDZ4",
    "title": "HILETA (LEITZA)",
    "publishedAt": "2025-07-24T09:40:31Z"
  },
  {
    "videoId": "DPU4Uj19tlk",
    "title": "HILETA (BERUETE)",
    "publishedAt": "2025-07-23T13:31:20Z"
  },
  {
    "videoId": "7bs2yo7fM9o",
    "title": "SANTA MARIA MAGDALENA 2025 (GOIZUETA)",
    "publishedAt": "2025-07-22T12:59:42Z"
  },
  {
    "videoId": "No8V3jJBNlo",
    "title": "HILETA (LEITZA)",
    "publishedAt": "2025-07-21T10:13:51Z"
  },
  {
    "videoId": "JWUSLPU6GJU",
    "title": "UZko XVI. IGANDEA (ARESO)",
    "publishedAt": "2025-07-20T10:45:18Z"
  },
  {
    "videoId": "ktrltM7TxDQ",
    "title": "HILETA (MUSKITZ)",
    "publishedAt": "2025-07-19T17:59:48Z"
  },
  {
    "videoId": "Hxjn3YmH9J8",
    "title": "2025(e)ko uztailakren 18(a)",
    "publishedAt": "2025-07-18T11:45:03Z"
  },
  {
    "videoId": "sC7DgA70ZzM",
    "title": "UZko XV. OSTEGUNA (LEKUNBERRI)",
    "publishedAt": "2025-07-17T17:46:34Z"
  },
  {
    "videoId": "XSp-SGJZro0",
    "title": "HILETA (INTZA)",
    "publishedAt": "2025-07-16T19:37:23Z"
  },
  {
    "videoId": "taYMWlshYd0",
    "title": "SAN BUENAVENTURA (LEKUNBERRI)",
    "publishedAt": "2025-07-15T18:01:23Z"
  },
  {
    "videoId": "29SNtVuYXUE",
    "title": "JOSE JAVIER MUGICAren ALDEKO MEZA (LEITZA",
    "publishedAt": "2025-07-14T21:36:14Z"
  },
  {
    "videoId": "S1O-SqYyp4g",
    "title": "UZko XV. IGANDEA (LEITZA)",
    "publishedAt": "2025-07-13T14:34:47Z"
  },
  {
    "videoId": "GYqQms-dN9Q",
    "title": "UZko XV. IGANDEA (LEKUNBERRI)",
    "publishedAt": "2025-07-12T18:20:29Z"
  },
  {
    "videoId": "NlHFcM-TFm0",
    "title": "SAN BENITO (BETELU",
    "publishedAt": "2025-07-11T12:26:16Z"
  },
  {
    "videoId": "sjaEwpu84qE",
    "title": "JUEVES XIV del T.O. (AGUSTINAS ALDATZ)",
    "publishedAt": "2025-07-10T09:32:20Z"
  },
  {
    "videoId": "BLHZ-SLLjsc",
    "title": "UZko XIV. ASTEAZKENA (LEITZA)",
    "publishedAt": "2025-07-09T18:46:14Z"
  },
  {
    "videoId": "PDJFBMzI-lU",
    "title": "UZko XIV. ASTEARTEA (LEITZA",
    "publishedAt": "2025-07-08T18:29:51Z"
  },
  {
    "videoId": "b2lJ4lao5Yo",
    "title": "SAN FERMIN 2025 (AZKARATE)",
    "publishedAt": "2025-07-07T12:47:31Z"
  },
  {
    "videoId": "LEIpX3SbfoQ",
    "title": "UZko XIV. IGANDEA (ARANO)",
    "publishedAt": "2025-07-06T09:50:24Z"
  },
  {
    "videoId": "QZY26AMVw5I",
    "title": "HILDAKOEN ALDEKO MEZA (OSKOTZ",
    "publishedAt": "2025-07-05T16:49:19Z"
  },
  {
    "videoId": "3qrzj7FGtdw",
    "title": "BERRIOTXOAKO SAN BALENTIN (BETELU)",
    "publishedAt": "2025-07-04T13:29:40Z"
  },
  {
    "videoId": "6PSsVomIcOg",
    "title": "HILETA (LEKUNBERRI)",
    "publishedAt": "2025-07-03T18:40:41Z"
  },
  {
    "videoId": "mcLNoL4r8rw",
    "title": "HILETA (BERUETE)",
    "publishedAt": "2025-06-30T22:12:13Z"
  },
  {
    "videoId": "sWss-4cmxC0",
    "title": "SAN PEDRO 2025 (GORRIZTARAN)",
    "publishedAt": "2025-06-29T23:39:31Z"
  },
  {
    "videoId": "bc8oVjwmUJ8",
    "title": "JULIKO KATEDRALA: AMERIKETAKO ERROMA/CATEDRAL DE JULI: LA ROMA DE AMÉRICA.",
    "publishedAt": "2025-06-29T16:23:14Z"
  },
  {
    "videoId": "2_5ZmN_5moY",
    "title": "SAN PEDRO 2025 (ARESO)",
    "publishedAt": "2025-06-29T12:43:04Z"
  },
  {
    "videoId": "Z-OIVDwX0HA",
    "title": "LEITZAKO GAU GURTZAILEEN 75. eta 50. URTEURRENAK",
    "publishedAt": "2025-06-29T02:52:20Z"
  },
  {
    "videoId": "5Hh8pXsJBqY",
    "title": "HAZPARNE. JESUSEN BIHOTZAREN KAPERA",
    "publishedAt": "2025-06-27T05:00:13Z"
  },
  {
    "videoId": "ORPB6hCkJuI",
    "title": "JESUSEN BIHOTZA",
    "publishedAt": "2025-06-26T23:25:56Z"
  },
  {
    "videoId": "orIj1lPjtcc",
    "title": "SAN JOAN BATAIATZAILEA 2025 (ATALLU)",
    "publishedAt": "2025-06-25T06:26:29Z"
  },
  {
    "videoId": "L-5SxMMaJTQ",
    "title": "SENDOTZAK 2025 (LEKUNBERRI)",
    "publishedAt": "2025-06-24T19:26:30Z"
  },
  {
    "videoId": "ZTU5ka4vTHk",
    "title": "HILETA (LEITZA)",
    "publishedAt": "2025-06-23T17:14:02Z"
  },
  {
    "videoId": "GRrC6WtLHPA",
    "title": "KRISTOREN GORPUTZ-ODOLAK 2025 (ARESO)",
    "publishedAt": "2025-06-22T07:44:59Z"
  },
  {
    "videoId": "ATDR7YsYUDA",
    "title": "CORPUS CHRISTI BEZPERA (ETXARRI-LARRAUN)",
    "publishedAt": "2025-06-21T16:45:03Z"
  },
  {
    "videoId": "IrMLzKRWivY",
    "title": "UZko XI. OSTIRALA (BETELU)",
    "publishedAt": "2025-06-20T11:15:52Z"
  },
  {
    "videoId": "1c12ZQepdMI",
    "title": "HILETA (LEITZA)",
    "publishedAt": "2025-06-19T19:34:17Z"
  },
  {
    "videoId": "bNFh0X8VxbM",
    "title": "MIERCOLES XI. DEL T.O. (AGUSTINAS ALDATZ)",
    "publishedAt": "2025-06-18T08:34:18Z"
  },
  {
    "videoId": "TfZr3o6_k7s",
    "title": "UXko XI. ASTEARTEA (LEKUNBERRI)",
    "publishedAt": "2025-06-17T17:41:30Z"
  },
  {
    "videoId": "-hceksyIglo",
    "title": "UZko XI. ASTELEHENA (LEKUNBERRI)",
    "publishedAt": "2025-06-16T17:46:07Z"
  },
  {
    "videoId": "bV7hRzgyRi8",
    "title": "HIRUTASUN  SANTUA 2025 (ERGAKO TRINITATEA)",
    "publishedAt": "2025-06-15T20:28:28Z"
  },
  {
    "videoId": "6sJXJKk5VVc",
    "title": "SAN MIGELEN MEZA (BERAMENDI)",
    "publishedAt": "2025-06-14T11:00:19Z"
  },
  {
    "videoId": "FuRTVEk8SWs",
    "title": "SAN MIGELEN MEZA (ITSASO)",
    "publishedAt": "2025-06-13T11:00:24Z"
  },
  {
    "videoId": "gv7gf5W0T4k",
    "title": "SAN MIGELEN MEZA (IHABEN)",
    "publishedAt": "2025-06-12T11:01:18Z"
  },
  {
    "videoId": "qSN3aSeJDAU",
    "title": "HILETA (BETELU)",
    "publishedAt": "2025-06-11T11:01:21Z"
  },
  {
    "videoId": "WEb1uRVioCY",
    "title": "HILETA (LEITZA)",
    "publishedAt": "2025-06-10T11:00:52Z"
  },
  {
    "videoId": "6vnYMVWzoQs",
    "title": "SAN DONATOKO ERROMERIA 2025/ PENTEKOSTE (BETELU)",
    "publishedAt": "2025-06-08T22:00:07Z"
  },
  {
    "videoId": "LzxpoCN8-w0",
    "title": "KOTXE BERRIAREN BEDEINKAPENA",
    "publishedAt": "2025-06-08T15:20:08Z"
  },
  {
    "videoId": "fma7Gpas7U4",
    "title": "LEHEN JAUNARTZEAK/ PENTEKOSTE 2025 (LEKUNBERRI)",
    "publishedAt": "2025-06-08T13:13:23Z"
  },
  {
    "videoId": "ikKfwRahhBY",
    "title": "LARUNBETLARI 2025 (ARALARKO SAN MIGEL)",
    "publishedAt": "2025-06-07T16:54:59Z"
  },
  {
    "videoId": "QTbRXUINQzk",
    "title": "SAN NORBERTO (BETELU",
    "publishedAt": "2025-06-06T15:06:00Z"
  },
  {
    "videoId": "CeZ0USXtEH4",
    "title": "HILETA (BETELU)",
    "publishedAt": "2025-06-05T18:19:49Z"
  },
  {
    "videoId": "MK2G5lTlIwA",
    "title": "PAZKOALDIKO VII. ASTEAZKENA (LEITZA)",
    "publishedAt": "2025-06-04T18:20:05Z"
  },
  {
    "videoId": "dTgtW5xFdFE",
    "title": "HILETA (LEITZA)",
    "publishedAt": "2025-06-03T06:18:39Z"
  },
  {
    "videoId": "WjEsnetzcX0",
    "title": "HILETA (IGOA)",
    "publishedAt": "2025-06-01T23:19:48Z"
  },
  {
    "videoId": "42eq_K49EBw",
    "title": "IGOKUNDEA (ITSASO) SALBATORE ERMITA",
    "publishedAt": "2025-06-01T17:14:43Z"
  },
  {
    "videoId": "u4DKZklj9NU",
    "title": "VISITACIÓN DE NUESTRA SEÑORA (AGUSTINAS ALDATZ)",
    "publishedAt": "2025-05-31T08:42:50Z"
  },
  {
    "videoId": "fwQnQx2jEh8",
    "title": "ARMIARMA SAREAK KENTZEKO SISTEMA BIKAINA",
    "publishedAt": "2025-05-30T17:25:36Z"
  },
  {
    "videoId": "et38g_H-tE4",
    "title": "SAN FERNANDO (BETELU)",
    "publishedAt": "2025-05-30T14:11:29Z"
  },
  {
    "videoId": "VyE-TWhR8HQ",
    "title": "DONOSTIAKO ARTZAI ONAREN KATEDRALA. LUMINISCENCE IKUSKIZUNA",
    "publishedAt": "2025-05-29T23:12:10Z"
  },
  {
    "videoId": "DPtD672km4s",
    "title": "SAN PAULO VI. (LEITZA)",
    "publishedAt": "2025-05-29T19:27:53Z"
  },
  {
    "videoId": "8dEcXw1soVg",
    "title": "PAZKOALDIKO VI. ASTEAZKENA (LEITZA)",
    "publishedAt": "2025-05-28T18:33:41Z"
  },
  {
    "videoId": "5Mc6nANWrys",
    "title": "SAN MIGELEN BISITA 2025 (ARANO)",
    "publishedAt": "2025-05-27T01:24:27Z"
  },
  {
    "videoId": "EJENK8D04n8",
    "title": "SAN MIGELEN BISITA 2025 (ARESO)",
    "publishedAt": "2025-05-26T03:26:04Z"
  },
  {
    "videoId": "RT0ckdXIU4o",
    "title": "SAN MIGELEN BISITA/SENDOTZAK 2025 (LEITZA)",
    "publishedAt": "2025-05-25T00:44:02Z"
  },
  {
    "videoId": "8xNBXwyssao",
    "title": "LEHEN JAUNARTZEAK 2025 (LEITZA)",
    "publishedAt": "2025-05-24T13:04:46Z"
  },
  {
    "videoId": "2exhe9rvyu4",
    "title": "PAZKOALDIKO V. OSTIRALA (BETELU)",
    "publishedAt": "2025-05-23T11:06:05Z"
  },
  {
    "videoId": "u9WLWWkwXTk",
    "title": "PAZKOALDIKO V. OSTEGUNA (LEITZA)",
    "publishedAt": "2025-05-22T18:37:14Z"
  },
  {
    "videoId": "I9ozg67yc5g",
    "title": "PAZKOALDIKO V. ASTEAZKENA (LEITZA)",
    "publishedAt": "2025-05-21T18:20:28Z"
  },
  {
    "videoId": "5wGOAvuydFE",
    "title": "SAN MIGELEN BISITA 2025 (GARTZARON)",
    "publishedAt": "2025-05-20T16:58:25Z"
  },
  {
    "videoId": "8SK9Pu3KdwM",
    "title": "HILETA (LEITZA)",
    "publishedAt": "2025-05-19T09:53:37Z"
  },
  {
    "videoId": "QlaFfXhJtAQ",
    "title": "LEHEN JAUNARTZEAK 2025/ PAZKOALDIKO V. IG. (BETELU)",
    "publishedAt": "2025-05-18T12:44:31Z"
  },
  {
    "videoId": "-pGpC8RlAlg",
    "title": "MAIATZEKO GURUTZE SANTUA 2025 (ARESO)",
    "publishedAt": "2025-05-17T11:23:18Z"
  },
  {
    "videoId": "YWb1MvBUF9s",
    "title": "LE LINGUE DI PAPA LEONE XIV/ LOS IDIOMAS DEL PAPA/ AITA SANTUAREN HIZKUNTZAK",
    "publishedAt": "2025-05-16T14:44:30Z"
  },
  {
    "videoId": "jzRI3KQ4Po4",
    "title": "PAZKOALDIKO IV. OSTIRALA (BETELU)",
    "publishedAt": "2025-05-16T10:36:37Z"
  },
  {
    "videoId": "ncZ76W_Naqw",
    "title": "HILETA (ARRIBE)",
    "publishedAt": "2025-05-15T10:52:20Z"
  },
  {
    "videoId": "HX0cej39_Fc",
    "title": "HILETA (IGOA)",
    "publishedAt": "2025-05-14T11:09:19Z"
  },
  {
    "videoId": "V0eXvXhdpoM",
    "title": "SAN MIGELEN BISITA 2025 (JAUNTSARATS)",
    "publishedAt": "2025-05-13T08:51:31Z"
  },
  {
    "videoId": "p597BrksmvA",
    "title": "SAN MIGELEN BISITA 2025 (BERUETE)",
    "publishedAt": "2025-05-12T20:50:44Z"
  },
  {
    "videoId": "Ph3q1zhj8uY",
    "title": "APU TAYTAYKU (KYRIE ELEISON KETXUAZ/ EN QUECHUA)",
    "publishedAt": "2025-05-11T17:29:34Z"
  },
  {
    "videoId": "q9HH8P6MGJk",
    "title": "ARTZAI ONA/ SAN MIGELEN AGERPENA (ARRUITZ)",
    "publishedAt": "2025-05-11T14:48:01Z"
  },
  {
    "videoId": "LR4AIpWoPkA",
    "title": "SAN MIGELEN MEZA (ALLI)",
    "publishedAt": "2025-05-10T14:01:50Z"
  },
  {
    "videoId": "hWY0z4v8B_c",
    "title": "BERRUEZAKO SAN GREGORIO (BETELU)",
    "publishedAt": "2025-05-09T09:46:26Z"
  },
  {
    "videoId": "0wDAk_YZZqE",
    "title": "MIERCOLES III DE PASCUA (AGUSTINAS ALDATZ)",
    "publishedAt": "2025-05-07T08:02:33Z"
  },
  {
    "videoId": "RFMzeeBa9LQ",
    "title": "AITA SANTU IZATEKO \"FABORITOAK\"/ FAVORITOS PARA SER PAPA/ I PIÙ IMPORTANTI PAPABILI . CONCLAVE 2025",
    "publishedAt": "2025-05-07T06:15:13Z"
  },
  {
    "videoId": "cnNOt8g4_fQ",
    "title": "PAZKOALDIKO III. ASTEARTEA (LEKUNBERRI)",
    "publishedAt": "2025-05-06T17:07:43Z"
  },
  {
    "videoId": "rKxAQpFjFdA",
    "title": "PAZKOALDIKO III. ASTELEHENA (LEITZA)",
    "publishedAt": "2025-05-05T19:01:22Z"
  },
  {
    "videoId": "BbL_h_r2cKE",
    "title": "DOMINGO III DE PASCUA",
    "publishedAt": "2025-05-04T15:07:13Z"
  },
  {
    "videoId": "2OjtORZU-Yc",
    "title": "SAN MIGELEN MEZA (MUSKITZ)",
    "publishedAt": "2025-05-03T00:24:05Z"
  },
  {
    "videoId": "P8IJYDOZGhU",
    "title": "SAN MIGELEN MEZA (OSKOTZ)",
    "publishedAt": "2025-05-02T07:00:21Z"
  },
  {
    "videoId": "qwzvbKkeyQk",
    "title": "SAN JOSE LANGILEA (GOLDARATZ)",
    "publishedAt": "2025-05-01T14:43:34Z"
  },
  {
    "videoId": "7843dbna-Cg",
    "title": "SAN PIO V. (LEITZA)",
    "publishedAt": "2025-04-30T18:47:03Z"
  },
  {
    "videoId": "YKbAViTgU5k",
    "title": "PAZKOALDIKO 2. ASTEARTEA (LEKUNBERRI)",
    "publishedAt": "2025-04-29T21:19:45Z"
  },
  {
    "videoId": "ujPwuMGP-HI",
    "title": "HILETA (BARAIBAR)",
    "publishedAt": "2025-04-28T10:24:11Z"
  },
  {
    "videoId": "ykw-OA_jHyU",
    "title": "PAZKOALDIKO 2. IGANDEA/SANTA ENGRAZIA 2025 (UITZI)",
    "publishedAt": "2025-04-27T15:31:12Z"
  },
  {
    "videoId": "zHT2kNjq0w4",
    "title": "SAN MIGELEN BISITA 2025 (ETXALEKU)",
    "publishedAt": "2025-04-26T12:46:51Z"
  },
  {
    "videoId": "hreb7LaYR_0",
    "title": "SAN MIGELEN BISITA 2025 (ERASO)",
    "publishedAt": "2025-04-25T22:46:15Z"
  },
  {
    "videoId": "yj3exMldSe4",
    "title": "SAN MIGELEN BISITA 2025 (ETXARRI-LARRAUN)",
    "publishedAt": "2025-04-23T23:29:29Z"
  },
  {
    "videoId": "xtj9g16-uuM",
    "title": "KLARATARREN DESPEDIDA/ DESPEDIDA DE LAS CLARISAS ETA SAN MIGELEN BISITA (LEKUNBERRI) 2025",
    "publishedAt": "2025-04-22T23:02:58Z"
  },
  {
    "videoId": "yZBW7yo60Po",
    "title": "SAN MIGELEN BISITA 2025 (INTZA)",
    "publishedAt": "2025-04-22T10:51:40Z"
  },
  {
    "videoId": "l7OOKPXIYzk",
    "title": "PAZKO BIGARRENA- SAN MIGELEN BISITA (BETELU)",
    "publishedAt": "2025-04-21T16:47:54Z"
  },
  {
    "videoId": "j8qFLrDf_B0",
    "title": "KARDENAL ELEKTOREEN ZERRENDA/ LISTA DE CARDENALES ELECTORES. GOIAN BEGO FRANTZISKO.",
    "publishedAt": "2025-04-21T09:31:16Z"
  },
  {
    "videoId": "DEYXM77ATUY",
    "title": "PAZKO IGANDEA, SAN MIGELEN JETSIERA 2025 (BARAIBAR)",
    "publishedAt": "2025-04-20T20:13:23Z"
  },
  {
    "videoId": "LF01wtAl4c8",
    "title": "PAZKO BEILA 2025 (ARESO)",
    "publishedAt": "2025-04-19T21:29:58Z"
  },
  {
    "videoId": "wcKM4SmTBCs",
    "title": "VENID, VENID, LAMENTOS",
    "publishedAt": "2025-04-18T22:56:20Z"
  },
  {
    "videoId": "BlK_BMYpIio",
    "title": "OSTIRAL SANTUA 2025 (ARESO)",
    "publishedAt": "2025-04-18T17:43:01Z"
  },
  {
    "videoId": "J_Hsdui_0ns",
    "title": "OSTIRAL SANTUA  2025 GURUTZ BIDEA (LEITZA)",
    "publishedAt": "2025-04-18T08:11:47Z"
  },
  {
    "videoId": "zTNdwuylhIw",
    "title": "OSTEGUN SANTUA 2025 (ARESO)",
    "publishedAt": "2025-04-17T17:57:26Z"
  },
  {
    "videoId": "ZXYCO5hLASI",
    "title": "KRISMA MEZA 2025 (IRUÑAKO KATEDRALA/CATEDRAL DE PAMPLONA)",
    "publishedAt": "2025-04-16T16:49:26Z"
  },
  {
    "videoId": "WmXocEmvJ90",
    "title": "SANTA ENGRAZIA 2025 (UITZI)",
    "publishedAt": "2025-04-16T00:11:22Z"
  },
  {
    "videoId": "08nffazMTBs",
    "title": "ASTEARTE SANTUA (LEITZA)",
    "publishedAt": "2025-04-15T18:35:12Z"
  },
  {
    "videoId": "Gc84r0Il7R4",
    "title": "ASTELEHEN SANTUA 2025 (LEITZA)",
    "publishedAt": "2025-04-14T18:39:05Z"
  },
  {
    "videoId": "HTNeuF8k7Tc",
    "title": "ERRAMU IGANDEA 2025 (IHABEN)",
    "publishedAt": "2025-04-13T09:16:20Z"
  },
  {
    "videoId": "0HfYAxqvdYY",
    "title": "ERRAMU IGANDE BEZPERA 2025/ VISPERA DEL DOMINGO DE RAMOS (ERASO)",
    "publishedAt": "2025-04-12T16:39:06Z"
  },
  {
    "videoId": "sFZgGp1j4ko",
    "title": "ASTE SANTUA/ SEMANA SANTA 2025. OSPAKIZUNEN ORDUTEGIAK/ HORARIO DE LAS CELEBRACIONES",
    "publishedAt": "2025-04-11T20:37:28Z"
  },
  {
    "videoId": "IT657yCZXtQ",
    "title": "GARIZUMAKO V.  OSTIRALA (BETELU)",
    "publishedAt": "2025-04-11T11:22:14Z"
  },
  {
    "videoId": "2w4HVZMOJWA",
    "title": "GARIZUMAKO V. OSTEGUNA (LEITZA)",
    "publishedAt": "2025-04-10T18:24:54Z"
  },
  {
    "videoId": "tE9UPfsmnHs",
    "title": "GARIZUMAKO V. ASTEAZKENA (LEITZA)",
    "publishedAt": "2025-04-09T18:23:15Z"
  },
  {
    "videoId": "Qmh45lXa2p8",
    "title": "MARTES V  DE CUARESMA (CLARISAS LEKUNBERRI)",
    "publishedAt": "2025-04-08T17:34:41Z"
  },
  {
    "videoId": "ON1VhImapms",
    "title": "HILETA (LEITZA)",
    "publishedAt": "2025-04-07T07:34:38Z"
  },
  {
    "videoId": "41Lmwc7ybaY",
    "title": "www.47herri.eus WEB ORRIAREN AURKEZPENA/ PRESENTACIÓN DE LA NUEVA PÁGINA WEB",
    "publishedAt": "2025-04-06T11:38:40Z"
  },
  {
    "videoId": "LYyjui2NSL4",
    "title": "GARIZUMAKO V. IGANDEA (LEKUNBERRI)",
    "publishedAt": "2025-04-06T07:24:48Z"
  },
  {
    "videoId": "oc9R-U2V_NM",
    "title": "EN ESTA TARDE CRISTO DEL CALVARIO",
    "publishedAt": "2025-04-05T20:16:09Z"
  },
  {
    "videoId": "M19DxRpyn_8",
    "title": "HILETA (LEKUNBERRI)",
    "publishedAt": "2025-04-05T08:27:36Z"
  },
  {
    "videoId": "nqd8ATdeJf0",
    "title": "GARIZUMAKO IV. OSTIRALA (BETELU)",
    "publishedAt": "2025-04-04T10:46:18Z"
  },
  {
    "videoId": "k-9yU_gM2fI",
    "title": "GARIZUMAKO IV.  OSTEGUNA (GOLDARATZ)",
    "publishedAt": "2025-04-03T14:45:01Z"
  },
  {
    "videoId": "H85vZ0TaKtw",
    "title": "GARIZUMAKO IV.  ASTEAZKENA (LEITZA)",
    "publishedAt": "2025-04-02T18:44:07Z"
  },
  {
    "videoId": "5sUQmIZdleE",
    "title": "HILETA (LEITZA)",
    "publishedAt": "2025-04-01T17:06:04Z"
  },
  {
    "videoId": "OGW09KLKQYc",
    "title": "GARIZUMAKO IV. ASTELEHENA (LEITZA)",
    "publishedAt": "2025-03-31T19:36:34Z"
  },
  {
    "videoId": "6BnnwA3VaBA",
    "title": "GARIZUMAKO 4. IGANDEA (ARANO)",
    "publishedAt": "2025-03-30T10:01:22Z"
  },
  {
    "videoId": "QUOsHs1mYMo",
    "title": "GARIZUMAKO IV. IGANDEA (LEKUNBERRI)",
    "publishedAt": "2025-03-29T18:27:58Z"
  },
  {
    "videoId": "uds-Oyoet_o",
    "title": "GARIZUMAKO III. OSTIRALA (BETELU)",
    "publishedAt": "2025-03-28T13:31:19Z"
  },
  {
    "videoId": "RZZNY5xVbTI",
    "title": "GARIZUMAKO III. OSTEGUNA (LEITZA)",
    "publishedAt": "2025-03-27T19:17:39Z"
  },
  {
    "videoId": "gN3_wfwwiQg",
    "title": "HILETA (UITZI)",
    "publishedAt": "2025-03-25T00:01:59Z"
  },
  {
    "videoId": "2W3KPSUdx3w",
    "title": "LUNES III DE CUARESMA (AGUSTINAS ALDATZ)",
    "publishedAt": "2025-03-24T09:09:21Z"
  },
  {
    "videoId": "0y3D7jmKH34",
    "title": "GARIZUMAKO III. IGANDEA/ESKRUTINIOAK (ARESO)",
    "publishedAt": "2025-03-23T13:01:15Z"
  },
  {
    "videoId": "zZxCtIywfIM",
    "title": "GARIZUMAKO III. IGANDE BEZPERA (LEITZA)",
    "publishedAt": "2025-03-22T20:42:11Z"
  },
  {
    "videoId": "q24o_5X64Fs",
    "title": "GARIZUMAKO 2. OSTIRALA (BETELU)",
    "publishedAt": "2025-03-21T14:11:09Z"
  },
  {
    "videoId": "dMYhlLPZhy8",
    "title": "JUEVES II de CUARESMA (CLARISAS LEKUNBERRI)",
    "publishedAt": "2025-03-20T18:33:38Z"
  },
  {
    "videoId": "-RfKLoJgMWQ",
    "title": "SAN JOSE 2025 (LEITZA)",
    "publishedAt": "2025-03-19T19:52:15Z"
  },
  {
    "videoId": "sZTWG6GK718",
    "title": "MARTES 2. DE CUARESMA (CLARISAS LEKUNBERRI)",
    "publishedAt": "2025-03-18T18:05:30Z"
  },
  {
    "videoId": "XCwBstRE4Vk",
    "title": "GARIZUMAKO 2. ASTELEHENA (LEITZA)",
    "publishedAt": "2025-03-17T19:21:19Z"
  },
  {
    "videoId": "h6kJFT_P-Sk",
    "title": "SEMINARIO EGUNA 2025. MIGUEL ARRIETA",
    "publishedAt": "2025-03-16T14:11:09Z"
  },
  {
    "videoId": "vMc1EuELa64",
    "title": "GARIZUMAKO 2. IGANDEA/SEMINARIO EGUNA (LEITZA)",
    "publishedAt": "2025-03-16T11:48:26Z"
  },
  {
    "videoId": "y2dpLcWhMVE",
    "title": "HILETA (LEZAETA)",
    "publishedAt": "2025-03-15T12:29:02Z"
  },
  {
    "videoId": "dGxw0z-JaiQ",
    "title": "GARIZUMAKO LEHEN OSTIRALA (BETELU)",
    "publishedAt": "2025-03-14T11:32:07Z"
  },
  {
    "videoId": "bh50Q5k0YaE",
    "title": "GARIZUMAKO LEHEN OSTEGUNA (LEITZA)",
    "publishedAt": "2025-03-13T19:20:26Z"
  },
  {
    "videoId": "C8tx1OedDaQ",
    "title": "GARIZUMAKO LEHEN ASTEAZKENA (LEITZA)",
    "publishedAt": "2025-03-12T19:31:26Z"
  },
  {
    "videoId": "pl6fKi0fjDE",
    "title": "MARTES I de CUARESMA (CLARISAS LEKUNBERRI)",
    "publishedAt": "2025-03-11T18:06:36Z"
  },
  {
    "videoId": "w_DdW2V6Pjk",
    "title": "HILETA (LEKUNBERRI)",
    "publishedAt": "2025-03-10T11:30:34Z"
  },
  {
    "videoId": "QAg0gBl5-04",
    "title": "GARIZUMAKO LEHEN IGANDEA (LEKUNBERRI)",
    "publishedAt": "2025-03-09T08:26:12Z"
  },
  {
    "videoId": "LRCHdq-eQHw",
    "title": "HILETA (LEITZA)",
    "publishedAt": "2025-03-08T09:43:11Z"
  },
  {
    "videoId": "pssl9Q3biic",
    "title": "GRAZIAREN BEDERATZIURRENA  2025 (XABIER) ARALAR-LARRAUN ARTZIPRESTALDEA",
    "publishedAt": "2025-03-07T13:22:59Z"
  },
  {
    "videoId": "e0xCQ8cRl-c",
    "title": "JAVIERADA SACERDOTAL/APEZEN XABIERRALDIA 2025",
    "publishedAt": "2025-03-06T15:23:11Z"
  },
  {
    "videoId": "x5333UwhPdc",
    "title": "ELKARRIZKETA ARALAR IRRATIAN (LEKUNBERRI 2025-03-05)",
    "publishedAt": "2025-03-05T19:58:36Z"
  },
  {
    "videoId": "n0HS19XcVPM",
    "title": "HAUSTERRE EGUNA 2025 (ARESO)",
    "publishedAt": "2025-03-05T18:07:11Z"
  },
  {
    "videoId": "ipDU1Dms0aQ",
    "title": "UZko VIII. ASTELEHENA (LEITZA)",
    "publishedAt": "2025-03-03T19:10:07Z"
  },
  {
    "videoId": "iwhWP6mDnnE",
    "title": "UZko VIII. IGANDEA (AZKARATE)",
    "publishedAt": "2025-03-02T07:49:15Z"
  },
  {
    "videoId": "tqFsTkeLbP4",
    "title": "HILETA (GOIZUETA)",
    "publishedAt": "2025-03-01T08:28:49Z"
  },
  {
    "videoId": "_psM5NyYb0Q",
    "title": "UZko VII. OSTIRALA (BETELU)",
    "publishedAt": "2025-02-28T11:53:57Z"
  },
  {
    "videoId": "m-yz86Kg1Rg",
    "title": "UZko VII. OSTEGUNA (LEITZA",
    "publishedAt": "2025-02-27T19:33:54Z"
  },
  {
    "videoId": "jpJ9Z9KBcnw",
    "title": "HILETA (LEITZA)",
    "publishedAt": "2025-02-26T18:03:58Z"
  },
  {
    "videoId": "H6-XbBg8HXo",
    "title": "2025eko ARTZIPRESTALDEKO XABIERALDIRAKO DEIA",
    "publishedAt": "2025-02-26T14:47:41Z"
  },
  {
    "videoId": "DbGlIBfu87E",
    "title": "MARTES VII. del T.O (CLARISAS LEKUNBERRI)",
    "publishedAt": "2025-02-25T18:17:32Z"
  },
  {
    "videoId": "LLhG0KPYqos",
    "title": "LUNES VII del T.O. (AGUSTINAS ALDATZ)",
    "publishedAt": "2025-02-24T08:54:10Z"
  },
  {
    "videoId": "xJ1rD00sDKU",
    "title": "UZko VII. IGANDEA (LEKUNBERRI)",
    "publishedAt": "2025-02-23T09:34:28Z"
  },
  {
    "videoId": "GIswwvHvJlU",
    "title": "HILETA (LEKUNBERRI)",
    "publishedAt": "2025-02-22T12:40:28Z"
  },
  {
    "videoId": "vK9IHqtGT8Q",
    "title": "UZko VI. OSTIRALA (BETELU)",
    "publishedAt": "2025-02-21T12:14:33Z"
  },
  {
    "videoId": "Gi16WRip74U",
    "title": "JUEVES VI. del T O. (AGUSTINAS ALDATZ)",
    "publishedAt": "2025-02-20T09:23:30Z"
  },
  {
    "videoId": "NbWFTkvBZcs",
    "title": "HILETA (BARAIBAR)",
    "publishedAt": "2025-02-19T09:17:53Z"
  },
  {
    "videoId": "ql19Eoqyj3U",
    "title": "HILETA (ARESO)",
    "publishedAt": "2025-02-18T16:13:51Z"
  },
  {
    "videoId": "ZQp9inPecRg",
    "title": "LUNES VI DEL T.O. (CLARISAS LEKUNBERRI)",
    "publishedAt": "2025-02-17T18:37:26Z"
  },
  {
    "videoId": "Pzu5huZMX1c",
    "title": "UZk9 VI. IGANDEA (ARESO)",
    "publishedAt": "2025-02-16T10:17:30Z"
  },
  {
    "videoId": "IHCBXVJS5Xk",
    "title": "HILETA (INTZA)",
    "publishedAt": "2025-02-15T16:31:41Z"
  },
  {
    "videoId": "6tFKOQqn88c",
    "title": "SAN ZIRILO ETA SAN METODIO (BETELU)",
    "publishedAt": "2025-02-14T13:39:26Z"
  },
  {
    "videoId": "492t6v9xnsA",
    "title": "UZko V. OSTEGUNA (LEITZA)",
    "publishedAt": "2025-02-13T19:38:30Z"
  },
  {
    "videoId": "ZtSHaTo9Xrs",
    "title": "HILETA (GORRITI)",
    "publishedAt": "2025-02-12T12:31:30Z"
  },
  {
    "videoId": "Az1cj2P4d4A",
    "title": "HILETA (LEITZA)",
    "publishedAt": "2025-02-11T17:59:04Z"
  },
  {
    "videoId": "zBzTOpGGuvs",
    "title": "HILETA (BETELU",
    "publishedAt": "2025-02-10T17:40:37Z"
  },
  {
    "videoId": "y240cVDHwt0",
    "title": "UZko V. IGANDEA (LEITZA)",
    "publishedAt": "2025-02-09T11:38:55Z"
  },
  {
    "videoId": "FR1Zz3BWL2c",
    "title": "URTEAN ZEHARREKO V. IGANDEA (LEKUNBERRI)",
    "publishedAt": "2025-02-08T18:45:25Z"
  },
  {
    "videoId": "AmWNWM3tjFg",
    "title": "UZko IV. OSTIRALA (BETELU)",
    "publishedAt": "2025-02-07T11:02:30Z"
  },
  {
    "videoId": "m7BMQva7z4E",
    "title": "SAN MARTIN IGOKUNDEARENA, SAN PABLO MIKI ETA LAGUN MARTIRIAK (GOLDARATZ)",
    "publishedAt": "2025-02-06T15:11:50Z"
  },
  {
    "videoId": "QKMdorgCi0o",
    "title": "SANTA AGEDA 2025 (ARRIBE)",
    "publishedAt": "2025-02-05T15:35:17Z"
  },
  {
    "videoId": "wHrOr5TamU4",
    "title": "HILETA (GOIZUETA)",
    "publishedAt": "2025-02-04T14:30:28Z"
  },
  {
    "videoId": "KW0kp_ws-i4",
    "title": "SAN BLAS 2025 (LEITZA)",
    "publishedAt": "2025-02-03T19:29:56Z"
  },
  {
    "videoId": "B9KVBJllvYk",
    "title": "KANDELERO 2025 (ETXALEKU)",
    "publishedAt": "2025-02-02T10:12:49Z"
  },
  {
    "videoId": "hM9Lq3rqBcQ",
    "title": "HILETA (LEITZA)",
    "publishedAt": "2025-02-01T12:02:09Z"
  },
  {
    "videoId": "6FjjyFIao_w",
    "title": "SAN JOAN BOSCO 2025 (BETELU)",
    "publishedAt": "2025-01-31T11:01:04Z"
  },
  {
    "videoId": "tFqjP_KND5w",
    "title": "UZko III. OSTEGUNA (LEITZA)",
    "publishedAt": "2025-01-30T19:32:50Z"
  },
  {
    "videoId": "yO7Z5BnhbfE",
    "title": "UZko III. ASTEAZKENA (LEITZA)",
    "publishedAt": "2025-01-29T19:25:01Z"
  },
  {
    "videoId": "GAlQ2W22UVQ",
    "title": "SANTO TOMAS DE AQUINO (CLARISAS LEKUNBERRI)",
    "publishedAt": "2025-01-28T18:14:19Z"
  },
  {
    "videoId": "2RGyJcXtmHo",
    "title": "HILETA (ARESO)",
    "publishedAt": "2025-01-27T17:59:11Z"
  },
  {
    "videoId": "djGRqdillGM",
    "title": "JAINKOAREN HITZAREN IGANDEA (ARESO)",
    "publishedAt": "2025-01-26T12:46:00Z"
  },
  {
    "videoId": "WTbiE_kiQtw",
    "title": "HILETA (UITZI)",
    "publishedAt": "2025-01-25T14:57:47Z"
  },
  {
    "videoId": "ibcuoTfR5N0",
    "title": "SAN FRANCISCO DE SALES (AGUSTINAS ALDATZ)",
    "publishedAt": "2025-01-24T08:54:44Z"
  },
  {
    "videoId": "8dg0kEycw0k",
    "title": "SAN ILDEFONTSO (LEITZA)",
    "publishedAt": "2025-01-23T20:04:12Z"
  },
  {
    "videoId": "N5p7c9ekCYc",
    "title": "SAN BIZENTE MARTIRIA",
    "publishedAt": "2025-01-22T19:34:24Z"
  },
  {
    "videoId": "qbucVw-a7fM",
    "title": "SANTA INES (CLARISAS LEKUNBERRI)",
    "publishedAt": "2025-01-21T18:18:17Z"
  },
  {
    "videoId": "Sfvi7MC7U8U",
    "title": "SAN SEBASTIAN 2025 (LEITZA)",
    "publishedAt": "2025-01-20T19:19:53Z"
  },
  {
    "videoId": "TfptrH9BrhE",
    "title": "KYRIE (REFICE) SAN SEBASTIAN EGUNA 2025",
    "publishedAt": "2025-01-20T13:49:09Z"
  },
  {
    "videoId": "4LhjoKuBAi8",
    "title": "UZko II. IGANDEA (GOIZUETA)",
    "publishedAt": "2025-01-19T15:11:49Z"
  },
  {
    "videoId": "C1zHGQl2QA8",
    "title": "URREZKO EZTAIAK (GOIZUETA)",
    "publishedAt": "2025-01-18T16:51:21Z"
  },
  {
    "videoId": "qgxocK0DwvA",
    "title": "SAN ANTONEN BERTSOAK (GOIZUETA)",
    "publishedAt": "2025-01-17T15:25:23Z"
  },
  {
    "videoId": "BbhgOalAnkQ",
    "title": "SAN ANTON 2025 (GOIZUETA)",
    "publishedAt": "2025-01-17T12:14:03Z"
  },
  {
    "videoId": "R5xF_c7oJSs",
    "title": "UZko lehen osteguna (LEITZA)",
    "publishedAt": "2025-01-16T19:16:46Z"
  },
  {
    "videoId": "zN09bYCA1q4",
    "title": "2025(e)ko urtarrilakren 15(a)",
    "publishedAt": "2025-01-15T14:15:29Z"
  },
  {
    "videoId": "77yQkbKsYM8",
    "title": "HILETA (LEITZA)",
    "publishedAt": "2025-01-12T17:56:29Z"
  },
  {
    "videoId": "zukaZf-I3Lc",
    "title": "11 de enero (CLARISAS LEKUNBERRI)",
    "publishedAt": "2025-01-11T11:07:28Z"
  },
  {
    "videoId": "4rNj59doGoE",
    "title": "2025(e)ko urtarrilakren 10(a)",
    "publishedAt": "2025-01-10T12:25:32Z"
  },
  {
    "videoId": "fqflnPhOBPM",
    "title": "FUNERAL SOR ANGELES (CLARISAS LEKUNBERRI)",
    "publishedAt": "2025-01-09T09:33:44Z"
  },
  {
    "videoId": "twjVj0dIUys",
    "title": "FUNERAL (LEKUNBERRI)",
    "publishedAt": "2025-01-08T10:38:16Z"
  },
  {
    "videoId": "0arCkz69k4A",
    "title": "SAN RAIMUNDO DE PENYAFORT (CLARISAS LEKUNBERRI)",
    "publishedAt": "2025-01-07T18:41:15Z"
  },
  {
    "videoId": "3BTPqPsnuuY",
    "title": "ERREGE EGUNA 2025 (LEITZA",
    "publishedAt": "2025-01-06T13:17:20Z"
  },
  {
    "videoId": "UDsLuKLpejo",
    "title": "HILETA (ARESO)",
    "publishedAt": "2025-01-05T20:00:57Z"
  },
  {
    "videoId": "EOC9OfmZCw0",
    "title": "ERREGE BEZPERA 2025 (BETELU). KANTOREAK APEZ ETXEAN",
    "publishedAt": "2025-01-05T19:20:52Z"
  },
  {
    "videoId": "G9tLoYMn3b0",
    "title": "EGUBERRI ONDORENGO BIGARREN IGANDEA (ALDATZ)",
    "publishedAt": "2025-01-04T19:24:26Z"
  },
  {
    "videoId": "VT7nEmA9vVY",
    "title": "2025(e)ko urtarrilakren 3(a)",
    "publishedAt": "2025-01-03T11:12:54Z"
  },
  {
    "videoId": "dQiWbAkRYd4",
    "title": "SAN BASILIO Y SAN GREGORIO",
    "publishedAt": "2025-01-02T18:58:20Z"
  },
  {
    "videoId": "aVEv23E7cSA",
    "title": "DIVINA MATERNITÀ DI MARIA",
    "publishedAt": "2025-01-01T18:33:35Z"
  },
  {
    "videoId": "yTgxXI7hfnE",
    "title": "HILETA (LEITZA)",
    "publishedAt": "2024-12-30T10:00:56Z"
  },
  {
    "videoId": "6P-kT6CGkbU",
    "title": "FAMILIA SANTUAREN IGANDEA (LEKUNBERRI)",
    "publishedAt": "2024-12-29T08:41:27Z"
  },
  {
    "videoId": "2c7WeQhb4hM",
    "title": "HILETA (LEKUNBERRI)",
    "publishedAt": "2024-12-28T10:48:06Z"
  },
  {
    "videoId": "L-xK6NiPihI",
    "title": "SAN JOAN APOSTOLU ETA EBANJELARIA ( BETELU",
    "publishedAt": "2024-12-27T11:42:17Z"
  },
  {
    "videoId": "9UvpoRJX5BQ",
    "title": "EGUBERRI EGUNA 2024 (LEITZA)",
    "publishedAt": "2024-12-26T02:36:41Z"
  },
  {
    "videoId": "nkXu8HHlUic",
    "title": "MISA DE VÍSPERA DE NAVIDAD (GOLDARATZ)",
    "publishedAt": "2024-12-24T18:12:44Z"
  },
  {
    "videoId": "eEcldBNfmpY",
    "title": "2024ko EGUBERRI ZORIONTSUAK IZAN DENOK/ FELICITACIÓN DE  LA NAVIDAD 2024",
    "publishedAt": "2024-12-23T21:09:57Z"
  },
  {
    "videoId": "Ce-Ihwm9dI0",
    "title": "ABENDUAK 23 (LEITZA)",
    "publishedAt": "2024-12-23T19:51:17Z"
  },
  {
    "videoId": "2XIuR6_HZnI",
    "title": "ABENDUALDIKO IV. IGANDEA (ETXARRI-LARRAUN)",
    "publishedAt": "2024-12-21T20:03:46Z"
  },
  {
    "videoId": "4HTjzXKrqT4",
    "title": "FUNERAL (URRITZA)",
    "publishedAt": "2024-12-21T19:20:36Z"
  },
  {
    "videoId": "faZ155PCMMg",
    "title": "20 de diciembre (AGUSTINAS ALDATZ",
    "publishedAt": "2024-12-20T08:45:44Z"
  },
  {
    "videoId": "51nB-EjJHi8",
    "title": "ABENDUAK 19 (LEITZA",
    "publishedAt": "2024-12-19T19:27:20Z"
  },
  {
    "videoId": "TGROtvS27cY",
    "title": "HILETA (ARRIBE)",
    "publishedAt": "2024-12-16T07:24:38Z"
  },
  {
    "videoId": "H_D9VI-vFqY",
    "title": "DOMINICA GAUDETE 2024 (LEITZA",
    "publishedAt": "2024-12-15T14:28:33Z"
  },
  {
    "videoId": "mWG_ILduPvY",
    "title": "ABENDUALDIKO III. IGANDEA (LEKUNBERRI)",
    "publishedAt": "2024-12-14T20:57:38Z"
  },
  {
    "videoId": "0Me3xLe1JDI",
    "title": "SANTA LUZIA 2024 ( ARRUITZ",
    "publishedAt": "2024-12-13T11:58:39Z"
  },
  {
    "videoId": "edHmx162ypo",
    "title": "HILETA (BERASTEGI)",
    "publishedAt": "2024-12-12T18:59:07Z"
  },
  {
    "videoId": "ktBVe0cHHq8",
    "title": "ABENDUALDIKO II. ASTEAZKENA (LEITZA)",
    "publishedAt": "2024-12-11T20:03:39Z"
  },
  {
    "videoId": "O6YB45Qy10s",
    "title": "MARTES II DE ADVIENTO (CLARISAS LEKUNBERRI)",
    "publishedAt": "2024-12-10T18:17:20Z"
  },
  {
    "videoId": "EKmh0PNWZj0",
    "title": "ABENDUALDIKO II. ASTELEHENA (LEITZA)",
    "publishedAt": "2024-12-09T20:54:11Z"
  },
  {
    "videoId": "ynpVEohtdYs",
    "title": "AGUR MARIA 18 HIZKUNTZETAN/ AVE MARIA EN 18 IDIOMAS/ HAIL MARY IN 18 LANGUAGES",
    "publishedAt": "2024-12-08T17:28:52Z"
  },
  {
    "videoId": "qb8PTgMRuJI",
    "title": "AMA BIRJINAREN SORTZE GARBIA 2024 (LEITZA)",
    "publishedAt": "2024-12-08T12:15:06Z"
  },
  {
    "videoId": "Jt9JUnrzuiI",
    "title": "HILETA (BETELU)",
    "publishedAt": "2024-12-07T09:33:10Z"
  },
  {
    "videoId": "CvbRJUS8pJY",
    "title": "SAN NICOLAS (AGUSTINAS ALDATZ",
    "publishedAt": "2024-12-06T08:41:35Z"
  },
  {
    "videoId": "O7_9dOW94Os",
    "title": "ABENDUALDIKO LEHEN OSTEGUNA (LEITZA)",
    "publishedAt": "2024-12-05T21:50:49Z"
  },
  {
    "videoId": "3WMagv7t7OQ",
    "title": "HILETA (LEITZA)",
    "publishedAt": "2024-12-04T15:42:31Z"
  },
  {
    "videoId": "5UdTeqA-3Qc",
    "title": "SAN FRANTZISKO XABIER 2024 (LEITZA)",
    "publishedAt": "2024-12-03T11:41:05Z"
  },
  {
    "videoId": "GI-OQjWwP0c",
    "title": "HILETA (ARESO",
    "publishedAt": "2024-12-02T14:12:20Z"
  },
  {
    "videoId": "XNZv7IPNNZM",
    "title": "ABENDUALDIKO LEHEN IGANDEA (ARANO) FLORENCIO ROSELLÓ APEZPIKUAREN LEHEN MEZA EUSKERAZ",
    "publishedAt": "2024-12-01T12:45:19Z"
  },
  {
    "videoId": "DsJNTuwitog",
    "title": "SAN ANDRES (CLARISAS LEKUNBERRI)",
    "publishedAt": "2024-11-30T21:13:59Z"
  },
  {
    "videoId": "_O7vECycQjk",
    "title": "SAZERNIN 2024 (BETELU)",
    "publishedAt": "2024-11-29T11:39:31Z"
  },
  {
    "videoId": "PZsecvD020I",
    "title": "UZko XXXIV. OSTEGUNA (LEITZA)",
    "publishedAt": "2024-11-28T19:10:19Z"
  },
  {
    "videoId": "HbkbNY3Cm0c",
    "title": "MIRARIETAKO AMA BIRJINA (LEITZA)",
    "publishedAt": "2024-11-27T20:51:21Z"
  },
  {
    "videoId": "QAd8LwZ4Sq4",
    "title": "SAN LEONARDO DE PORTO MAURIZIO (CLARISAS LEKUNBERRI)",
    "publishedAt": "2024-11-26T18:07:55Z"
  },
  {
    "videoId": "ixrddX8mPag",
    "title": "HILETA (LEITZA)",
    "publishedAt": "2024-11-25T12:07:08Z"
  },
  {
    "videoId": "KbCAKKk14zE",
    "title": "HARRERA ERRITOA/RITO DE ADMISIÓN (IRUÑAKO SEMINARIOA/ SEMINARIO DE PAMPLONA) 2024-XI-24",
    "publishedAt": "2024-11-24T19:06:24Z"
  },
  {
    "videoId": "E614rsYXRhc",
    "title": "KRISTO ERREGE 2024 (LEITZA)",
    "publishedAt": "2024-11-24T11:08:17Z"
  },
  {
    "videoId": "HhXhSxQdP30",
    "title": "HILETA (LEITZA)",
    "publishedAt": "2024-11-23T10:35:05Z"
  },
  {
    "videoId": "ElpLQBkOBmc",
    "title": "SANTA ZEZILIA (BETELU)",
    "publishedAt": "2024-11-22T11:38:22Z"
  },
  {
    "videoId": "RNz6LLfJy8k",
    "title": "HILETA (GOIZUETA)",
    "publishedAt": "2024-11-21T19:54:21Z"
  },
  {
    "videoId": "9VBZ-wOMlb8",
    "title": "UZk9 XXXIII. ASTEAZKENA (LEITZA)",
    "publishedAt": "2024-11-20T19:29:26Z"
  },
  {
    "videoId": "GHggbmOd6OY",
    "title": "MARTES XXXIII del T.O. (CLARISAS LEKUNBERRI)",
    "publishedAt": "2024-11-19T18:19:17Z"
  },
  {
    "videoId": "WwkGxWPfU9I",
    "title": "UZko XXXIII. ASTELEHENA (LEITZA)",
    "publishedAt": "2024-11-18T19:08:59Z"
  },
  {
    "videoId": "16vEhsnTtro",
    "title": "UZko XXXIII. IGANDEA (BERUETE)",
    "publishedAt": "2024-11-17T11:15:04Z"
  },
  {
    "videoId": "zlqLqPH0Pns",
    "title": "HILETA (ARRIBE)",
    "publishedAt": "2024-11-16T17:26:46Z"
  },
  {
    "videoId": "MRD6MyBM3w8",
    "title": "SAN ALBERTO HANDIA (BETELU)",
    "publishedAt": "2024-11-15T11:19:06Z"
  },
  {
    "videoId": "rQX3hXy8foM",
    "title": "UZko XXXII. OSTEGUNA (LEITZA)",
    "publishedAt": "2024-11-14T19:12:12Z"
  },
  {
    "videoId": "apWPPEx3_hk",
    "title": "UZko XXXII. ASTEAZKENA (LEITZA)",
    "publishedAt": "2024-11-13T19:16:08Z"
  },
  {
    "videoId": "R0R59EC0kzM",
    "title": "SAN JOSAFAT (CLARISAS LEKUNBERRI)",
    "publishedAt": "2024-11-12T18:10:20Z"
  },
  {
    "videoId": "pIoyh9Og4j8",
    "title": "SAN MARTIN 2024 (GAINTZA)",
    "publishedAt": "2024-11-11T13:24:35Z"
  },
  {
    "videoId": "5AgyjgnsVDQ",
    "title": "UZko XXXII. IGANDEA (BETELU)",
    "publishedAt": "2024-11-10T13:29:28Z"
  },
  {
    "videoId": "azq8Hi2mxXI",
    "title": "XXXII. IGANDEA/DOMINGO  (ERASO",
    "publishedAt": "2024-11-09T18:21:25Z"
  },
  {
    "videoId": "u1OvJw3J7wI",
    "title": "UZko XXXI. OSTIRALA (BETELU)",
    "publishedAt": "2024-11-08T11:10:04Z"
  },
  {
    "videoId": "FOxVtFOOSEQ",
    "title": "UZko XXXI. OSTEGUNA (GOLDARATZ)",
    "publishedAt": "2024-11-07T15:30:55Z"
  },
  {
    "videoId": "2Pm1IFACRzE",
    "title": "SAN PEDRO POVEDA ETA LAGUN MARTIRIAK (LEITZA)",
    "publishedAt": "2024-11-06T19:37:03Z"
  },
  {
    "videoId": "fNCSeiWszEg",
    "title": "MARTES XXXI. DEL T.O. (CLARISAS LEKUNBERRI)",
    "publishedAt": "2024-11-05T18:22:14Z"
  },
  {
    "videoId": "XWNv7vQgmrM",
    "title": "SAN CARLOS BORROMEO (LEITZA)",
    "publishedAt": "2024-11-04T20:09:55Z"
  },
  {
    "videoId": "urgwBZFEXy0",
    "title": "UZko XXXI. IGANDEA (ARANO)",
    "publishedAt": "2024-11-03T11:10:34Z"
  },
  {
    "videoId": "JffUNnz3ib0",
    "title": "HILDAKO GUZTIEN OROIPENA 2024 (LEKUNBERRI)",
    "publishedAt": "2024-11-02T19:31:05Z"
  },
  {
    "videoId": "VdfsbzGc26Y",
    "title": "SANTU GUZTIEN EGUNA 2024 (ARESO)",
    "publishedAt": "2024-11-01T11:23:05Z"
  },
  {
    "videoId": "LsKiRHjIo_o",
    "title": "VISPERA DE TODOS LOS SANTOS 2024 (CLARISAS LEKUNBERRI)",
    "publishedAt": "2024-10-31T19:24:09Z"
  },
  {
    "videoId": "wFGPaWqxgFk",
    "title": "HILETA/FUNERAL  (LEITZA",
    "publishedAt": "2024-10-30T17:57:33Z"
  },
  {
    "videoId": "6OejZBaifSw",
    "title": "HILETA (ARESO)",
    "publishedAt": "2024-10-29T17:13:10Z"
  },
  {
    "videoId": "-KPnHG5asMc",
    "title": "SAN SIM9N Y SAN JUDAS (CLARISAS LEKUNBERRI)",
    "publishedAt": "2024-10-28T19:36:49Z"
  },
  {
    "videoId": "l3qnvbNmYSg",
    "title": "UZko XXX. IGANDEA (LEITZA)",
    "publishedAt": "2024-10-27T13:42:17Z"
  },
  {
    "videoId": "fv5sHRciCY4",
    "title": "SÁBADO XXIX. del T.O. (CLARISAS LEKUNBERRI)",
    "publishedAt": "2024-10-26T09:44:15Z"
  },
  {
    "videoId": "2vrxHWaA_oc",
    "title": "UZko XXIX. OSTIRALA (BETELU)",
    "publishedAt": "2024-10-25T09:56:36Z"
  },
  {
    "videoId": "-GjeueYBjfk",
    "title": "UZko XXIX. OSTEGUNA(LEITZA)",
    "publishedAt": "2024-10-24T19:00:13Z"
  },
  {
    "videoId": "ayqp9tSRzis",
    "title": "HILETA (GOIZUETA)",
    "publishedAt": "2024-10-23T11:00:08Z"
  },
  {
    "videoId": "PF9CSjdCHjs",
    "title": "FUNERAL (LEITZA)",
    "publishedAt": "2024-10-22T08:03:30Z"
  },
  {
    "videoId": "Dgy1akKDgd8",
    "title": "HILETA (GAINTZA",
    "publishedAt": "2024-10-21T17:26:27Z"
  },
  {
    "videoId": "_t7zcp3Lpo0",
    "title": "UZko XXIX. IGANDEA (ITSASO)",
    "publishedAt": "2024-10-20T09:10:07Z"
  },
  {
    "videoId": "ntePIElORFc",
    "title": "FUNERAL (BETELU)",
    "publishedAt": "2024-10-19T20:10:04Z"
  },
  {
    "videoId": "i7OmoQ6hNWs",
    "title": "SAN LUKAS 2024 (UITZI)",
    "publishedAt": "2024-10-18T10:25:22Z"
  },
  {
    "videoId": "dAJHEVhrKIw",
    "title": "ANTIOKIAKO SAN IÑAZIO (LEITZA)",
    "publishedAt": "2024-10-17T18:37:23Z"
  },
  {
    "videoId": "XNDKvuXY8uw",
    "title": "MIERCOLES XXVIII. DEL T.O. (CLARISAS LEKUNBERRI)",
    "publishedAt": "2024-10-16T18:26:39Z"
  },
  {
    "videoId": "6ngqZwHR_68",
    "title": "HILETA (LEITZA)",
    "publishedAt": "2024-10-15T15:28:06Z"
  },
  {
    "videoId": "5fpARV0IcuE",
    "title": "AMERIKETAKO EUSKAL ARTZAIEN MEZA (BERUETE)",
    "publishedAt": "2024-10-14T10:26:17Z"
  },
  {
    "videoId": "BvJ942BlIQo",
    "title": "UZko XXVIII. IGANDEA (ARESO)",
    "publishedAt": "2024-10-13T09:51:38Z"
  },
  {
    "videoId": "H8B0suI99o4",
    "title": "PILAREKO AMAREN EGUNA 2024 (LEKUNBERRI)",
    "publishedAt": "2024-10-12T14:51:02Z"
  },
  {
    "videoId": "Vg-Yb-iFFds",
    "title": "PILAREKO AMAREN BEDERATZIURRENA (LEKUNBERRI)",
    "publishedAt": "2024-10-11T08:33:37Z"
  },
  {
    "videoId": "gm8ro6ULNxg",
    "title": "HILETA (ERRAZKIN)",
    "publishedAt": "2024-10-10T12:56:36Z"
  },
  {
    "videoId": "0SQ4UnQE3Jo",
    "title": "AMA BIRJINAREN DEBOZIOZKO MEZA (LEKUNBERRI)",
    "publishedAt": "2024-10-09T11:20:14Z"
  },
  {
    "videoId": "bs4K4bOI0B8",
    "title": "PILAREKO AMAREN BEDERATZIURRENA (LEKUNBERRI)",
    "publishedAt": "2024-10-08T08:08:41Z"
  },
  {
    "videoId": "7QcncjEclBg",
    "title": "HILETA (BERUETE)",
    "publishedAt": "2024-10-07T11:08:33Z"
  },
  {
    "videoId": "8DVMxFIENLw",
    "title": "UZk9 XXVII. IGANDEA (ALDATZ)",
    "publishedAt": "2024-10-06T08:34:28Z"
  },
  {
    "videoId": "AgWPl1G-aSI",
    "title": "KOLABORATZAILE  BERRIAREN AURKEZPENA",
    "publishedAt": "2024-10-05T19:20:48Z"
  },
  {
    "videoId": "Km56WbWp01Q",
    "title": "PILAREKO AMAREN BEDERATZIURRENA (LEKUNBERRI)",
    "publishedAt": "2024-10-05T07:34:11Z"
  },
  {
    "videoId": "cKtXbUaOrj0",
    "title": "ASISKO SAN FRANTZISKO (BETELU)",
    "publishedAt": "2024-10-04T10:16:20Z"
  },
  {
    "videoId": "_Njhd38vX4U",
    "title": "SAN FRANTZISKO BORJA (LEITZA)",
    "publishedAt": "2024-10-03T18:24:36Z"
  },
  {
    "videoId": "Tc4beewt-is",
    "title": "AINGERU ZAINDARIAK (LEITZA)",
    "publishedAt": "2024-10-02T18:37:49Z"
  },
  {
    "videoId": "88dvjCR8PWg",
    "title": "SANTA TERESITA DEL NIÑO JESUS (AGUSTINAS ALDATZ)",
    "publishedAt": "2024-10-01T08:16:15Z"
  },
  {
    "videoId": "ypgwuUz4XXQ",
    "title": "SAN JERONIMO (LEITZA)",
    "publishedAt": "2024-09-30T20:15:09Z"
  },
  {
    "videoId": "voW-xJB6VdI",
    "title": "SAN MIGEL 2024 (BERAMENDI)",
    "publishedAt": "2024-09-29T08:51:21Z"
  },
  {
    "videoId": "dC6mfhVQyAA",
    "title": "GURUTZE SANTUAREN DEBOZIOZKO MEZA 2024  (INTZA)",
    "publishedAt": "2024-09-28T16:39:55Z"
  },
  {
    "videoId": "GMAkTRDi4wI",
    "title": "SAN BIZENTE PAUL (BETELU)",
    "publishedAt": "2024-09-27T10:14:13Z"
  },
  {
    "videoId": "rKt_ZWDg4C0",
    "title": "UZko XXV. OSTEGUNA (LEITZA)",
    "publishedAt": "2024-09-26T18:29:01Z"
  },
  {
    "videoId": "DOKP3MmgtJw",
    "title": "HILETA (LEITZA)",
    "publishedAt": "2024-09-25T14:27:22Z"
  },
  {
    "videoId": "kmLZlL05h_c",
    "title": "MARTES XXV. del T.O. (LEITZA)",
    "publishedAt": "2024-09-24T16:10:32Z"
  },
  {
    "videoId": "-qf_NK68yL8",
    "title": "SAN PIO PIETRELCINAKOA (LEITZA)",
    "publishedAt": "2024-09-23T19:16:43Z"
  },
  {
    "videoId": "E1lNPWY3Vis",
    "title": "TUTERAKO KATEDRALA/ CATEDRAL DE TUDELA",
    "publishedAt": "2024-09-22T19:01:30Z"
  },
  {
    "videoId": "3PA6Q--kpP8",
    "title": "UZko XXV. IGANDEA (LEITZA)",
    "publishedAt": "2024-09-22T10:23:09Z"
  },
  {
    "videoId": "s8df8VKL-N8",
    "title": "HILETA/FUNERAL (LEITZA)",
    "publishedAt": "2024-09-21T20:21:08Z"
  },
  {
    "videoId": "z1xrTj0_j1o",
    "title": "UZko XXIV. OSTIRALA (BETELU)",
    "publishedAt": "2024-09-20T10:56:13Z"
  },
  {
    "videoId": "V2hEusu_ZRw",
    "title": "UZko XXIV. OSTEGUNA (LEITZA)",
    "publishedAt": "2024-09-19T18:22:08Z"
  },
  {
    "videoId": "cA1AG_MKKRA",
    "title": "HILETA (ARESO)",
    "publishedAt": "2024-09-18T08:48:12Z"
  },
  {
    "videoId": "k7X78G5yhb0",
    "title": "DIMARTS XXIV DEL T. O.",
    "publishedAt": "2024-09-17T08:11:38Z"
  },
  {
    "videoId": "ZPYEvsC0tWg",
    "title": "SANT CEBRIÁ 2024",
    "publishedAt": "2024-09-16T15:11:12Z"
  },
  {
    "videoId": "FFFkpQ23BT4",
    "title": "UZko XXIV. IGANDEA (ARANO)",
    "publishedAt": "2024-09-15T10:08:41Z"
  },
  {
    "videoId": "T7hxq_dey8E",
    "title": "GURUTZE SANTUAREN GORALPENA 2024 (LEITZA)",
    "publishedAt": "2024-09-14T08:29:34Z"
  },
  {
    "videoId": "yxFpcA13ccI",
    "title": "SAN JOAN KRISOSTOMO (BETELU)",
    "publishedAt": "2024-09-13T10:36:34Z"
  },
  {
    "videoId": "1kzT_FccCbQ",
    "title": "UZko XXIII. OSTEGUNA (LEITZA)",
    "publishedAt": "2024-09-12T19:04:07Z"
  },
  {
    "videoId": "HYO2kuKkwJI",
    "title": "UZko XXIII. ASTEAZKENA (LEITZA)",
    "publishedAt": "2024-09-11T19:07:54Z"
  },
  {
    "videoId": "Ndq6k3HArxI",
    "title": "MARTES XXIII DEL T.O. (CLARISAS LEKUNBERRI)",
    "publishedAt": "2024-09-10T17:18:42Z"
  },
  {
    "videoId": "PVFYFD9VX2I",
    "title": "ARANTZAZUKO AMA 2024 (GORRIZTARAN)",
    "publishedAt": "2024-09-09T17:30:57Z"
  },
  {
    "videoId": "nBPhZ8GiPc0",
    "title": "AMA BIRJINAREN JAIOTZA 2024 (INTZA)",
    "publishedAt": "2024-09-08T10:05:19Z"
  },
  {
    "videoId": "FiYkkxpxFPk",
    "title": "HILETA (GOIZUETA)",
    "publishedAt": "2024-09-07T18:54:11Z"
  },
  {
    "videoId": "wwNTTgzZFME",
    "title": "VIERNES XXII DELNT.O. (CLARISAS LEKUNBERRI)",
    "publishedAt": "2024-09-06T19:10:42Z"
  },
  {
    "videoId": "Jp7QDllfWFw",
    "title": "UZko XXII. OSTEGUNA (GOLDARATZ)",
    "publishedAt": "2024-09-05T15:02:31Z"
  },
  {
    "videoId": "bFTInWlR5k4",
    "title": "UZko XXII. ASTEAZKENA (LEITZA)",
    "publishedAt": "2024-09-04T18:35:53Z"
  },
  {
    "videoId": "KGBkQQ_6vm4",
    "title": "SAN GREGORIO MAGNO (AGUSTINAS ALDATZ)",
    "publishedAt": "2024-09-03T10:05:33Z"
  },
  {
    "videoId": "814-YOR8xHQ",
    "title": "UZko XXII. ASTELEHENA (LEITZA)",
    "publishedAt": "2024-09-02T19:17:52Z"
  },
  {
    "videoId": "h8BiXU3L6I4",
    "title": "GURUTZEEN EGUNA/UZko XXII. IGANDEA  (ARALARKO SAN MIGEL)",
    "publishedAt": "2024-09-01T14:56:51Z"
  },
  {
    "videoId": "AT9bZWarBnM",
    "title": "ZUDAIREKO ESTEBAN, MAIORGAKO JOAN ETA LAGUN MARTIRIAK (BETELU)",
    "publishedAt": "2024-08-30T12:39:00Z"
  },
  {
    "videoId": "fcJaC0j6_Bk",
    "title": "SAN JOAN BATAIATZAILEAREN MARTIRITZA 2024 (IRIBAS)",
    "publishedAt": "2024-08-29T17:35:45Z"
  },
  {
    "videoId": "BsNryFCC2vs",
    "title": "SAN AGUSTIN 2024 (ARTIKUTZA)",
    "publishedAt": "2024-08-28T14:00:09Z"
  },
  {
    "videoId": "bTHIYIKU9cY",
    "title": "SANTA MONICA (CLARISAS LEKUNBERRI)",
    "publishedAt": "2024-08-27T17:38:01Z"
  },
  {
    "videoId": "F9mkpGaVlzU",
    "title": "2024ko GURUTZEEN EGUNERAKO GONBIDAPENA/ INVITACIÓN PARA EL DÍA DE LAS CRUCES EN ARALAR",
    "publishedAt": "2024-08-27T15:10:14Z"
  },
  {
    "videoId": "W5nxqdDVHzM",
    "title": "HILETA (UITZI)",
    "publishedAt": "2024-08-26T11:59:08Z"
  },
  {
    "videoId": "P3bfYBRpdcc",
    "title": "GURE AITA \"BERRIA\"",
    "publishedAt": "2024-08-25T15:05:42Z"
  },
  {
    "videoId": "JFBXm80QLW4",
    "title": "UZko XXI. IGANDEA (ARESO)",
    "publishedAt": "2024-08-25T10:13:27Z"
  },
  {
    "videoId": "pJqwUGLW4dY",
    "title": "SAN BARTOLOME 2024 (GORRITI)",
    "publishedAt": "2024-08-24T11:43:22Z"
  },
  {
    "videoId": "I0BOb6kwEQU",
    "title": "HILETA (BETELU)",
    "publishedAt": "2024-08-19T19:52:06Z"
  },
  {
    "videoId": "SGXlj3paXwA",
    "title": "URTEAN ZEHARREKO XX. IGANDEA (LEITZA)",
    "publishedAt": "2024-08-18T10:35:28Z"
  },
  {
    "videoId": "E0NYqrSa47A",
    "title": "UZk9 XX. IGANDEA (ETXARRI-LARRAUN)",
    "publishedAt": "2024-08-17T16:50:10Z"
  },
  {
    "videoId": "Dgkyh1HTXZU",
    "title": "SAN ROKE 2024 (ARANO)",
    "publishedAt": "2024-08-16T10:58:50Z"
  },
  {
    "videoId": "QjJA-5vS2vA",
    "title": "MARIAREN ZERURATZEA 2024 (ARESO)",
    "publishedAt": "2024-08-15T11:54:10Z"
  },
  {
    "videoId": "BAxNrZEcp5U",
    "title": "AMA BIRJINAREN ZERURATZEA,  BEZPERAKO MEZA (LEITZA)",
    "publishedAt": "2024-08-14T18:44:55Z"
  },
  {
    "videoId": "1dVtEq_pTNs",
    "title": "HILETA (LEITZA)",
    "publishedAt": "2024-08-12T07:26:33Z"
  },
  {
    "videoId": "gn946s8uWrI",
    "title": "EZPATA DANTZA. SAN TIBURTZIO EGUNA. LEITZA  2024",
    "publishedAt": "2024-08-11T12:31:40Z"
  },
  {
    "videoId": "yjb7wTt-O0A",
    "title": "SAN TIBURTZIO 2024  (LEITZA)",
    "publishedAt": "2024-08-11T12:20:20Z"
  },
  {
    "videoId": "P5XRrugmelE",
    "title": "SAN LORENTZO 2024 (ALBIASU)",
    "publishedAt": "2024-08-10T11:25:39Z"
  },
  {
    "videoId": "mTjIwp6SRMY",
    "title": "SANTA TERESA BENEDIKTA GURUTZEARENA (EDITH STEIN) BETELU",
    "publishedAt": "2024-08-09T11:04:43Z"
  },
  {
    "videoId": "wzq6vGzLvqE",
    "title": "SANTO DOMINGO DE GUZMAN (AGUSTINAS ALDATZ)",
    "publishedAt": "2024-08-08T09:16:45Z"
  },
  {
    "videoId": "-1-FPOhKims",
    "title": "HILETA (ETXALEKU)",
    "publishedAt": "2024-08-07T16:16:02Z"
  },
  {
    "videoId": "IonORaC-0wc",
    "title": "JAUNAREN ANTZALDAKETA 2024 (ERRAZKIN)",
    "publishedAt": "2024-08-06T11:07:00Z"
  },
  {
    "videoId": "VgG3U-Wj7-E",
    "title": "SANTA BARBARA 2024 (GORRITI)",
    "publishedAt": "2024-08-04T23:07:08Z"
  },
  {
    "videoId": "sDES-O-WtHI",
    "title": "UZko XVIII. IGANDEA (ARESO)",
    "publishedAt": "2024-08-04T10:04:08Z"
  },
  {
    "videoId": "KK6x4h9oV3s",
    "title": "ZERU LURREN EGILE ZERAN ESPIRITU SANTUA",
    "publishedAt": "2024-08-03T12:17:37Z"
  },
  {
    "videoId": "A9gPQBkFNyo",
    "title": "SAN ALFONSO MARIA LIGORIO (AGUSTINAS ALDATZ)",
    "publishedAt": "2024-08-01T10:03:59Z"
  },
  {
    "videoId": "x-IttBI9LzY",
    "title": "SAN IGNACIO DE LOYOLA (CLARISAS LEKUNBERRI)",
    "publishedAt": "2024-07-31T18:11:43Z"
  },
  {
    "videoId": "ia-PjO2ggWo",
    "title": "MARTES XVII. DEL TO (CLARISAS LEKUNBERRI)",
    "publishedAt": "2024-07-30T17:25:48Z"
  },
  {
    "videoId": "ZGqOmoCozaM",
    "title": "LAZARO, MARTA ETA MARIA SANTUAK (LEITZA)",
    "publishedAt": "2024-07-29T18:58:09Z"
  },
  {
    "videoId": "xYLGwpnjpFs",
    "title": "UZko XVII. IGANDEA (ARANO)",
    "publishedAt": "2024-07-28T10:17:32Z"
  },
  {
    "videoId": "0R1ZtfBMIRA",
    "title": "SABADO XVI del TO (CLARISAS LEKUNBERRI)",
    "publishedAt": "2024-07-27T08:37:51Z"
  },
  {
    "videoId": "VcA4lJEokZE",
    "title": "SAN JOAKIN ETA SANTA ANA (BETELU)",
    "publishedAt": "2024-07-26T10:33:22Z"
  },
  {
    "videoId": "nWRtU1awFBw",
    "title": "SANTIAGO APOSTOLUA 2024 (ARANO)",
    "publishedAt": "2024-07-25T10:30:41Z"
  },
  {
    "videoId": "okKvjWl1DYw",
    "title": "SAN CHARBEL (AGUSTINAS ALDATZ)",
    "publishedAt": "2024-07-24T09:41:20Z"
  },
  {
    "videoId": "Y57eCExjHZU",
    "title": "SANTA BRIGIDA (LEITZA)",
    "publishedAt": "2024-07-23T18:14:04Z"
  },
  {
    "videoId": "EbTkbBR69Lo",
    "title": "SANTA MARIA MAGDALENA 2024 (GOIZUETA)",
    "publishedAt": "2024-07-22T10:51:50Z"
  },
  {
    "videoId": "qJLlEEio2bc",
    "title": "UZko XVI. IGANDEA (LEITZA)",
    "publishedAt": "2024-07-21T10:36:04Z"
  },
  {
    "videoId": "haARYTWcgJI",
    "title": "HILETA/FUNERAL (LEKUNBERRI)",
    "publishedAt": "2024-07-20T00:06:22Z"
  },
  {
    "videoId": "gfCwlWJAu44",
    "title": "UZko XV. OSTIRALA (BETELU)",
    "publishedAt": "2024-07-19T10:25:00Z"
  },
  {
    "videoId": "oz5DInIp79c",
    "title": "UZko XV. OSTEGUNA (LEITZA)",
    "publishedAt": "2024-07-18T18:30:37Z"
  },
  {
    "videoId": "KfgAqzZIoec",
    "title": "UZko XV. ASTEAZKENA (LEITZA)",
    "publishedAt": "2024-07-17T18:44:52Z"
  },
  {
    "videoId": "Tg2vgUezf4Y",
    "title": "NUESTRA SEÑORA DEL CARMEN (CLARISAS LEKUNBERRI)",
    "publishedAt": "2024-07-16T17:38:42Z"
  },
  {
    "videoId": "epo_H1EWCO4",
    "title": "SAN BUENAVENTURA (LEITZA)",
    "publishedAt": "2024-07-15T18:23:00Z"
  },
  {
    "videoId": "XlX5n4QGyBQ",
    "title": "HILETA (GOIZUETA)",
    "publishedAt": "2024-07-14T14:36:02Z"
  },
  {
    "videoId": "gFksCycLDs8",
    "title": "UZko XV. IGANDEA (LEKUNBERRI)",
    "publishedAt": "2024-07-13T17:46:49Z"
  },
  {
    "videoId": "1W4srXhVdQw",
    "title": "UZko XIV. OSTIRALA (BETELU)",
    "publishedAt": "2024-07-12T11:12:14Z"
  },
  {
    "videoId": "0AeFh1iGToI",
    "title": "SAN BENITO (CLARISAS LEKUNBERRI)",
    "publishedAt": "2024-07-11T18:58:16Z"
  },
  {
    "videoId": "wfVdT7ubqF4",
    "title": "UZko XIV. ASTEAZKENA (LEITZA)",
    "publishedAt": "2024-07-10T18:37:36Z"
  },
  {
    "videoId": "95SKqu_zj5s",
    "title": "MARTES XIV. DEL T.O. (CLARISAS LEKUNBERRI)",
    "publishedAt": "2024-07-09T17:41:31Z"
  },
  {
    "videoId": "NzK_zFc_e5s",
    "title": "HILETA (LEKUNBERRI)",
    "publishedAt": "2024-07-08T18:03:30Z"
  },
  {
    "videoId": "k5WBsNhvo0E",
    "title": "SAN FERMIN 2024 (AZKARATE)",
    "publishedAt": "2024-07-07T13:11:24Z"
  },
  {
    "videoId": "2h7BqXfZXlA",
    "title": "UZko XIV. IGANDEA (LEKUNBERRI)",
    "publishedAt": "2024-07-06T18:39:20Z"
  },
  {
    "videoId": "gQKVYy5Db9M",
    "title": "UZko XIII. OSTIRALA (BETELU)",
    "publishedAt": "2024-07-05T15:20:28Z"
  },
  {
    "videoId": "aZC83z-9XKM",
    "title": "UZko XIII. OSTEGUNA (GOLDARATZ)",
    "publishedAt": "2024-07-04T13:28:23Z"
  },
  {
    "videoId": "WVz_t7Ftzd8",
    "title": "SANTO TOMAS APOSTOLUA (LEITZA)",
    "publishedAt": "2024-07-03T18:49:50Z"
  },
  {
    "videoId": "ZrcAgBDcaJo",
    "title": "MARTES XIII DEL T.O. (CLARISAS LEKUNBERRI)",
    "publishedAt": "2024-07-02T17:55:08Z"
  },
  {
    "videoId": "g9vHupxxH5s",
    "title": "HILETA (GOIZUETA)",
    "publishedAt": "2024-07-01T13:08:59Z"
  },
  {
    "videoId": "rnpsreAe9Ao",
    "title": "UZko XIII. IGANDEA/ SAN PEDRO FESTAK (GORRIZTARAN)",
