[
  {
    "videoId": "uCchQMn0z44",
    "title": "Abendualdiko IV. Igandea. Arano",
    "publishedAt": "2025-12-21T12:02:33Z",
    "playlistId": "UUYibdEdQAPs55xBnIElKLkQ",
    "playlistName": "main"
  },
  {
    "videoId": "_-CFfulP6iY",
    "title": "Abendualdiko IV. Igandea. Lekunberri",
    "publishedAt": "2025-12-20T19:26:01Z",
    "playlistId": "UUYibdEdQAPs55xBnIElKLkQ",
    "playlistName": "main"
  },
  {
    "videoId": "gLAmZEpB3so",
    "title": "Abenduaren 19ko meza. Sta Kruz Beteluko Ermita",
    "publishedAt": "2025-12-19T11:34:43Z",
    "playlistId": "UUYibdEdQAPs55xBnIElKLkQ",
    "playlistName": "main"
  },
  {
    "videoId": "js-pPOz5q3I",
    "title": "Abenduaren 18ko meza. Lekunberri",
    "publishedAt": "2025-12-18T19:03:41Z",
    "playlistId": "UUYibdEdQAPs55xBnIElKLkQ",
    "playlistName": "main"
  },
  {
    "videoId": "k3ib0J2ojZI",
    "title": "Abenduaren 17ko meza. Leitza",
    "publishedAt": "2025-12-17T19:22:43Z",
    "playlistId": "UUYibdEdQAPs55xBnIElKLkQ",
    "playlistName": "main"
  },
  {
    "videoId": "az9GX3K2NzY",
    "title": "Hileta Luis Maria Beguiristain Madoz. 2025/12/16. Lekunberri",
    "publishedAt": "2025-12-16T17:26:15Z",
    "playlistId": "UUYibdEdQAPs55xBnIElKLkQ",
    "playlistName": "main"
  },
  {
    "videoId": "nR3fL91eLKA",
    "title": "Martes III Adviento. 16/12/25. Agustinas Aldatz",
    "publishedAt": "2025-12-16T08:57:51Z",
    "playlistId": "UUYibdEdQAPs55xBnIElKLkQ",
    "playlistName": "main"
  },
  {
    "videoId": "_CyHRtBpiUc",
    "title": "Abenduko III. Astelehena. 2025/12/15. Lekunberri",
    "publishedAt": "2025-12-15T18:25:00Z",
    "playlistId": "UUYibdEdQAPs55xBnIElKLkQ",
    "playlistName": "main"
  },
  {
    "videoId": "Ip1oVVEHcLU",
    "title": "Abendualdiko III. Igandea. Gaudete. 2025/12/14. Betelu",
    "publishedAt": "2025-12-14T13:53:38Z",
    "playlistId": "UUYibdEdQAPs55xBnIElKLkQ",
    "playlistName": "main"
  },
  {
    "videoId": "83gVEaC1Nqg",
    "title": "Abendualdiko III. Igandea. \"Gaudete\". 13/12/25. Leitza.",
    "publishedAt": "2025-12-13T20:04:39Z",
    "playlistId": "UUYibdEdQAPs55xBnIElKLkQ",
    "playlistName": "main"
  },
  {
    "videoId": "uOHbkxM8wgI",
    "title": "Abenduko II. Ostirala. 12/12/25. Beteluko Ermita",
    "publishedAt": "2025-12-12T10:57:42Z",
    "playlistId": "UUYibdEdQAPs55xBnIElKLkQ",
    "playlistName": "main"
  },
  {
    "videoId": "jFBVlbqzoUo",
    "title": "Jueves II semana Adviento. 11/12/25. Agustinas Aldatz",
    "publishedAt": "2025-12-11T08:52:15Z",
    "playlistId": "UUYibdEdQAPs55xBnIElKLkQ",
    "playlistName": "main"
  },
  {
    "videoId": "vTAuUOdOpLc",
    "title": "Hileta Imanol De Marcos Ibáñez. 10/12/25. Intza",
    "publishedAt": "2025-12-10T17:58:03Z",
    "playlistId": "UUYibdEdQAPs55xBnIElKLkQ",
    "playlistName": "main"
  },
  {
    "videoId": "uc8rDYCJEOo",
    "title": "Martes II Semana Adviento. 09/12/25. Agustinas Aldatz",
    "publishedAt": "2025-12-09T08:55:15Z",
    "playlistId": "UUYibdEdQAPs55xBnIElKLkQ",
    "playlistName": "main"
  },
  {
    "videoId": "q1xes_An-nU",
    "title": "Maria Sortzez Garbia eta Mª Esperanza López Valles. 08/12/25. Atallu",
    "publishedAt": "2025-12-08T17:46:41Z",
    "playlistId": "UUYibdEdQAPs55xBnIElKLkQ",
    "playlistName": "main"
  },
  {
    "videoId": "TN1UYlwe4ic",
    "title": "Maria Sortzez Garbia eta Lontxa Gorostegi Zabala. 07/12/25. Uitzi",
    "publishedAt": "2025-12-07T17:22:34Z",
    "playlistId": "UUYibdEdQAPs55xBnIElKLkQ",
    "playlistName": "main"
  },
  {
    "videoId": "vth27VcMv5s",
    "title": "Abendualdiko II. Igandea. 06/12/25. Lekunberri",
    "publishedAt": "2025-12-06T19:06:01Z",
    "playlistId": "UUYibdEdQAPs55xBnIElKLkQ",
    "playlistName": "main"
  },
  {
    "videoId": "-J-uXHtgry4",
    "title": "Abenduko I. Ostirala. 05/12/25. Santa Kruz Ermita Beteluko",
    "publishedAt": "2025-12-05T11:17:15Z",
    "playlistId": "UUYibdEdQAPs55xBnIElKLkQ",
    "playlistName": "main"
  },
  {
    "videoId": "_modhc-P0cI",
    "title": "Abenduko I. Osteguna 04/12/25. Goldaratz",
    "publishedAt": "2025-12-04T17:10:10Z",
    "playlistId": "UUYibdEdQAPs55xBnIElKLkQ",
    "playlistName": "main"
  },
  {
    "videoId": "86gL63ICk4E",
    "title": "Xabierko San Frantzisko. 03/12/25. Lekunberri",
    "publishedAt": "2025-12-03T09:12:00Z",
    "playlistId": "UUYibdEdQAPs55xBnIElKLkQ",
    "playlistName": "main"
  },
  {
    "videoId": "VyDO9w9NxR4",
    "title": "Martes 1ª Semana Adviento. 02/12/25. Agustinas Aldatz",
    "publishedAt": "2025-12-02T09:20:36Z",
    "playlistId": "UUYibdEdQAPs55xBnIElKLkQ",
    "playlistName": "main"
  },
  {
    "videoId": "XOs425tPutw",
    "title": "Abenduko I astelehena. 01/12/25. Lekunberri",
    "publishedAt": "2025-12-01T18:04:37Z",
    "playlistId": "UUYibdEdQAPs55xBnIElKLkQ",
    "playlistName": "main"
  },
  {
    "videoId": "4pLNccBCyVs",
    "title": "Abendualdiko I. Igandea. 30/11/25. Arano",
    "publishedAt": "2025-11-30T11:22:03Z",
    "playlistId": "UUYibdEdQAPs55xBnIElKLkQ",
    "playlistName": "main"
  },
  {
    "videoId": "icctAsuFuQM",
    "title": "Misa Virgen Carmen. 28/11/25. Carmelitas San Lorenzo de El Escorial",
    "publishedAt": "2025-11-28T12:46:28Z",
    "playlistId": "UUYibdEdQAPs55xBnIElKLkQ",
    "playlistName": "main"
  },
  {
    "videoId": "dL5P59Njc8M",
    "title": "La Milagrosa. 27/11/25. Agustinas Aldatz",
    "publishedAt": "2025-11-27T08:46:03Z",
    "playlistId": "UUYibdEdQAPs55xBnIElKLkQ",
    "playlistName": "main"
  },
  {
    "videoId": "pOOh8aKDlFw",
    "title": "Erasopean bizi diren kristauentzat. 26/11/25. Lekunberri",
    "publishedAt": "2025-11-26T11:36:10Z",
    "playlistId": "UUYibdEdQAPs55xBnIElKLkQ",
    "playlistName": "main"
  },
  {
    "videoId": "gQK7bOF8FfI",
    "title": "Martes XXXIV T. O. 25/11/25. Agustinas Aldatz",
    "publishedAt": "2025-11-25T09:09:44Z",
    "playlistId": "UUYibdEdQAPs55xBnIElKLkQ",
    "playlistName": "main"
  },
  {
    "videoId": "f_SOmLwQPPQ",
    "title": "San Andrés Dung-Lac y compañeros. 24/11/25. Lekunberri",
    "publishedAt": "2025-11-24T18:11:17Z",
    "playlistId": "UUYibdEdQAPs55xBnIElKLkQ",
    "playlistName": "main"
  },
  {
    "videoId": "JbsNZK8Cr68",
    "title": "Kristo Erregearen Festaburua. 23/11 /25. Betelu",
    "publishedAt": "2025-11-23T13:02:12Z",
    "playlistId": "UUYibdEdQAPs55xBnIElKLkQ",
    "playlistName": "main"
  },
  {
    "videoId": "L1DNfuPGa6o",
    "title": "Kristo Erregearen Solemnitatea, eta Susana Eguzquizaren aldeko Meza. 22/22/25. Lekunberri",
    "publishedAt": "2025-11-22T18:51:13Z",
    "playlistId": "UUYibdEdQAPs55xBnIElKLkQ",
    "playlistName": "main"
  },
  {
    "videoId": "H3c1x59vyrI",
    "title": "Presentación de la Virgen Maria. 21/11/25. Lekunberri",
    "publishedAt": "2025-11-21T18:29:40Z",
    "playlistId": "UUYibdEdQAPs55xBnIElKLkQ",
    "playlistName": "main"
  },
  {
    "videoId": "3FJ_HZsot8I",
    "title": "Uzko XXXIII. Osteguna. Lekunberri",
    "publishedAt": "2025-11-20T18:32:02Z",
    "playlistId": "UUYibdEdQAPs55xBnIElKLkQ",
    "playlistName": "main"
  },
  {
    "videoId": "aIm2hSoGA_k",
    "title": "Uzko XXXIII Asteazkena. Leitza",
    "publishedAt": "2025-11-19T19:32:49Z",
    "playlistId": "UUYibdEdQAPs55xBnIElKLkQ",
    "playlistName": "main"
  },
  {
    "videoId": "tCMzxWIqkKk",
    "title": "XXXIII TO. Martes 18/11/25. Agustinas. Aldatz",
    "publishedAt": "2025-11-18T08:50:55Z",
    "playlistId": "UUYibdEdQAPs55xBnIElKLkQ",
    "playlistName": "main"
  },
  {
    "videoId": "c4rVdhHTkEw",
    "title": "Hungariako Santa Isabel. 17/11/25. Lekunberri",
    "publishedAt": "2025-11-17T19:56:41Z",
    "playlistId": "UUYibdEdQAPs55xBnIElKLkQ",
    "playlistName": "main"
  },
  {
    "videoId": "t2i2la-FEFo",
    "title": "Uzko XXXII Ostirala. Beteluko Ermita",
    "publishedAt": "2025-11-14T11:50:43Z",
    "playlistId": "UUYibdEdQAPs55xBnIElKLkQ",
    "playlistName": "main"
  },
  {
    "videoId": "WrLJC3dJiwY",
    "title": "Espiritu Santuaren Meza. 13/11/25. Lekunberri",
    "publishedAt": "2025-11-13T19:53:29Z",
    "playlistId": "UUYibdEdQAPs55xBnIElKLkQ",
    "playlistName": "main"
  },
  {
    "videoId": "sqEBLI3Xk1Y",
    "title": "San Josafat. 12/11/25. Leitza",
    "publishedAt": "2025-11-12T19:19:16Z",
    "playlistId": "UUYibdEdQAPs55xBnIElKLkQ",
    "playlistName": "main"
  },
  {
    "videoId": "ZtXakyjfYfw",
    "title": "Tourseko San Martin. 11/11/25. Gaintza",
    "publishedAt": "2025-11-11T14:20:46Z",
    "playlistId": "UUYibdEdQAPs55xBnIElKLkQ",
    "playlistName": "main"
  },
  {
    "videoId": "3TdPxF5dZuk",
    "title": "San Martin de Tours. 11/11/25. Agustinas Aldatz. 134º Aniv. Fundación Convento",
    "publishedAt": "2025-11-11T08:53:12Z",
    "playlistId": "UUYibdEdQAPs55xBnIElKLkQ",
    "playlistName": "main"
  },
  {
    "videoId": "aA-Fh2guzQw",
    "title": "San Leon Handia. 10/11/25. Lekunberri",
    "publishedAt": "2025-11-10T19:16:50Z",
    "playlistId": "UUYibdEdQAPs55xBnIElKLkQ",
    "playlistName": "main"
  },
  {
    "videoId": "u0RnCgb51ek",
    "title": "Hileta Maria Josefa Arregui Arregui. 09/11/25. Aldatz",
    "publishedAt": "2025-11-09T17:35:18Z",
    "playlistId": "UUYibdEdQAPs55xBnIElKLkQ",
    "playlistName": "main"
  },
  {
    "videoId": "_uAiywCGidE",
    "title": "San Joan Laterango basilika nagusiaren dedikazioa. 08/11/25. Lekunberriko parrokoaren kargu-hartzea",
    "publishedAt": "2025-11-08T21:33:26Z",
    "playlistId": "UUYibdEdQAPs55xBnIElKLkQ",
    "playlistName": "main"
  },
  {
    "videoId": "g8vK-YPZjGs",
    "title": "Uzko XXXI Ostirala. 07/11/25. Beteluko Ermita",
    "publishedAt": "2025-11-07T13:50:05Z",
    "playlistId": "UUYibdEdQAPs55xBnIElKLkQ",
    "playlistName": "main"
  },
  {
    "videoId": "6Xg9St3ZTS8",
    "title": "Erlijio-jazarpeneko martiri dohatsuak. 06/11/26. Goldaratz",
    "publishedAt": "2025-11-06T14:36:39Z",
    "playlistId": "UUYibdEdQAPs55xBnIElKLkQ",
    "playlistName": "main"
  },
  {
    "videoId": "XrfP5AbuNQA",
    "title": "Miercoles 05/11/25. Agustinas Aldatz",
    "publishedAt": "2025-11-05T09:47:24Z",
    "playlistId": "UUYibdEdQAPs55xBnIElKLkQ",
    "playlistName": "main"
  },
  {
    "videoId": "oOz5vrs6IuQ",
    "title": "San Carlos Borromeo. 04/11/25. Agustinas Aldatz",
    "publishedAt": "2025-11-04T08:55:53Z",
    "playlistId": "UUYibdEdQAPs55xBnIElKLkQ",
    "playlistName": "main"
  },
  {
    "videoId": "0ALevP2D_jY",
    "title": "Hileta. Benita Sasturain Alberro. Jauntsarats",
    "publishedAt": "2025-11-03T10:04:10Z",
    "playlistId": "UUYibdEdQAPs55xBnIElKLkQ",
    "playlistName": "main"
  },
  {
    "videoId": "VC7dTQ7Au10",
    "title": "Hildako Guztien Eguna. 02/11/25. Arano",
    "publishedAt": "2025-11-02T11:32:31Z",
    "playlistId": "UUYibdEdQAPs55xBnIElKLkQ",
    "playlistName": "main"
  },
  {
    "videoId": "X28TsuOLxD8",
    "title": "Santu Guztien Eguna. 01/11/25. Lekunberri",
    "publishedAt": "2025-11-01T09:47:37Z",
    "playlistId": "UUYibdEdQAPs55xBnIElKLkQ",
    "playlistName": "main"
  },
  {
    "videoId": "DXGgL6dw7TE",
    "title": "Uzko XXX. Ostirala. 31/10 /25. Betelu",
    "publishedAt": "2025-10-31T11:36:26Z",
    "playlistId": "UUYibdEdQAPs55xBnIElKLkQ",
    "playlistName": "main"
  },
  {
    "videoId": "PVYrqLTRmHo",
    "title": "Jueves 30/10/25. Agustinas Aldatz",
    "publishedAt": "2025-10-30T08:54:38Z",
    "playlistId": "UUYibdEdQAPs55xBnIElKLkQ",
    "playlistName": "main"
  },
  {
    "videoId": "uCtb627Pk2Q",
    "title": "Uzko XXX. Asteazkena. 29/10/25. Leitza",
    "publishedAt": "2025-10-29T19:24:12Z",
    "playlistId": "UUYibdEdQAPs55xBnIElKLkQ",
    "playlistName": "main"
  },
  {
    "videoId": "iCCDshCxFrc",
    "title": "Simon y Tadeo Apóstoles. 28/10/25. Agustinas Aldatz",
    "publishedAt": "2025-10-28T08:46:56Z",
    "playlistId": "UUYibdEdQAPs55xBnIElKLkQ",
    "playlistName": "main"
  },
  {
    "videoId": "GWKxDsoH-rA",
    "title": "Agustinas Aldatz. 27/10/25",
    "publishedAt": "2025-10-27T09:10:38Z",
    "playlistId": "UUYibdEdQAPs55xBnIElKLkQ",
    "playlistName": "main"
  },
  {
    "videoId": "igYald-bRpA",
    "title": "Urko XXX Igandea. Leitza",
    "publishedAt": "2025-10-26T12:52:34Z",
    "playlistId": "UUYibdEdQAPs55xBnIElKLkQ",
    "playlistName": "main"
  },
  {
    "videoId": "EfF8LbFCPH0",
    "title": "Urtean Zeharreko XXX. Igandea. Lekunberri",
    "publishedAt": "2025-10-25T18:12:45Z",
    "playlistId": "UUYibdEdQAPs55xBnIElKLkQ",
    "playlistName": "main"
  },
  {
    "videoId": "iMrrwW_CCOE",
    "title": "Uzko XXIX. Ostirala. 24/10/25. Beteluko Ermita",
    "publishedAt": "2025-10-24T10:35:21Z",
    "playlistId": "UUYibdEdQAPs55xBnIElKLkQ",
    "playlistName": "main"
  },
  {
    "videoId": "9VA1uZYb3IE",
    "title": "Jueves 23/10/25. Lekunberri",
    "publishedAt": "2025-10-23T17:02:07Z",
    "playlistId": "UUYibdEdQAPs55xBnIElKLkQ",
    "playlistName": "main"
  },
  {
    "videoId": "E1TGsk2LKXw",
    "title": "San Joan Paulo IIa. (Leitza)",
    "publishedAt": "2025-10-22T18:17:41Z",
    "playlistId": "UUYibdEdQAPs55xBnIElKLkQ",
    "playlistName": "main"
  },
  {
    "videoId": "wDFFG-imn1A",
    "title": "Agustinas Aldatz. 21/10/25",
    "publishedAt": "2025-10-21T07:59:26Z",
    "playlistId": "UUYibdEdQAPs55xBnIElKLkQ",
    "playlistName": "main"
  },
  {
    "videoId": "5FAgioTJIB8",
    "title": "Hileta Geno Telletxea Elizalde. Areso",
    "publishedAt": "2025-10-20T17:02:56Z",
    "playlistId": "UUYibdEdQAPs55xBnIElKLkQ",
    "playlistName": "main"
  },
  {
    "videoId": "p2ynP4uo9Ag",
    "title": "DOMUND Igandea. 19/10/25. Betelu",
    "publishedAt": "2025-10-19T11:42:40Z",
    "playlistId": "UUYibdEdQAPs55xBnIElKLkQ",
    "playlistName": "main"
  },
  {
    "videoId": "4mE4L83LG_8",
    "title": "San Lukas. Uitzi",
    "publishedAt": "2025-10-18T10:04:38Z",
    "playlistId": "UUYibdEdQAPs55xBnIElKLkQ",
    "playlistName": "main"
  },
  {
    "videoId": "qewjQ08wlvU",
    "title": "Antiokiako San Inaxio. Beteluko Ermita 17/10/25",
    "publishedAt": "2025-10-17T11:14:54Z",
    "playlistId": "UUYibdEdQAPs55xBnIElKLkQ",
    "playlistName": "main"
  },
  {
    "videoId": "pJ96uKXS2hw",
    "title": "UZko XXVIII. Osteguna (Leitza)",
    "publishedAt": "2025-10-16T20:02:04Z",
    "playlistId": "UUYibdEdQAPs55xBnIElKLkQ",
    "playlistName": "main"
  },
  {
    "videoId": "ZTC3NsS69_o",
    "title": "Hileta - Ramón Garmendia Insausti. 13/10/25 (Betelu)",
    "publishedAt": "2025-10-13T17:07:29Z",
    "playlistId": "UUYibdEdQAPs55xBnIElKLkQ",
    "playlistName": "main"
  },
  {
    "videoId": "jDGqm8DVnW4",
    "title": "Pilareko Amaren Bederatziurrena bederaratzigarren eguna",
    "publishedAt": "2025-10-12T08:08:16Z",
    "playlistId": "UUYibdEdQAPs55xBnIElKLkQ",
    "playlistName": "main"
  },
  {
    "videoId": "oaoPhHdiPvI",
    "title": "Pilareko Amaren Bederatziurrena zortzigarren eguna",
    "publishedAt": "2025-10-11T07:38:07Z",
    "playlistId": "UUYibdEdQAPs55xBnIElKLkQ",
    "playlistName": "main"
  },
  {
    "videoId": "HW39By1_XZM",
    "title": "Pilareko Amaren Bederatziurrena zazpigarren eguna",
    "publishedAt": "2025-10-10T08:30:14Z",
    "playlistId": "UUYibdEdQAPs55xBnIElKLkQ",
    "playlistName": "main"
  },
  {
    "videoId": "OokXXIWwdns",
    "title": "Pilareko Amaren Bederatziurrena seigarren eguna",
    "publishedAt": "2025-10-09T07:20:53Z",
    "playlistId": "UUYibdEdQAPs55xBnIElKLkQ",
    "playlistName": "main"
  },
  {
    "videoId": "Sk880RGSxbY",
    "title": "Pilareko Amaren Bederatziurrena bostgarren eguna",
    "publishedAt": "2025-10-08T08:35:24Z",
    "playlistId": "UUYibdEdQAPs55xBnIElKLkQ",
    "playlistName": "main"
  },
  {
    "videoId": "BmOAGSPWEg0",
    "title": "Pilareko Amaren Bederatziurrena. 4. eguna (Lekunberri)",
    "publishedAt": "2025-10-07T08:32:46Z",
    "playlistId": "UUYibdEdQAPs55xBnIElKLkQ",
    "playlistName": "main"
  },
  {
    "videoId": "r6Dui5HPs54",
    "title": "Pilareko Amaren Bederatziurrena. 3. eguna (Lekunberri)",
    "publishedAt": "2025-10-06T13:36:20Z",
    "playlistId": "UUYibdEdQAPs55xBnIElKLkQ",
    "playlistName": "main"
  },
  {
    "videoId": "52F4I6VPXdQ",
    "title": "Pilareko Amaren Bederatziuerrena. 2. eguna (Lekunberri)",
    "publishedAt": "2025-10-05T07:47:27Z",
    "playlistId": "UUYibdEdQAPs55xBnIElKLkQ",
    "playlistName": "main"
  },
  {
    "videoId": "AxOJS6m3MAs",
    "title": "Pilareko Amaren Bederatziurrena (Lekunberri)",
    "publishedAt": "2025-10-04T07:12:19Z",
    "playlistId": "UUYibdEdQAPs55xBnIElKLkQ",
    "playlistName": "main"
  },
  {
    "videoId": "OvKu0hKO6lQ",
    "title": "Beteluko Ermita 03/10/25",
    "publishedAt": "2025-10-03T10:42:50Z",
    "playlistId": "UUYibdEdQAPs55xBnIElKLkQ",
    "playlistName": "main"
  },
  {
    "videoId": "RzUATQZVM1I",
    "title": "Aingeru Zaindariak - 02/10/25 (Lekunberri)",
    "publishedAt": "2025-10-02T17:33:48Z",
    "playlistId": "UUYibdEdQAPs55xBnIElKLkQ",
    "playlistName": "main"
  },
  {
    "videoId": "kR8VVu3F7-4",
    "title": "Santa Teresita Lisieuxkoa. 01/10/25. (Lekunberri)",
    "publishedAt": "2025-10-01T17:34:53Z",
    "playlistId": "UUYibdEdQAPs55xBnIElKLkQ",
    "playlistName": "main"
  },
  {
    "videoId": "aC9IrNI1Zto",
    "title": "San Jerónimo. 30/09/25.  Agustinas Aldatz",
    "publishedAt": "2025-09-30T10:42:37Z",
    "playlistId": "UUYibdEdQAPs55xBnIElKLkQ",
    "playlistName": "main"
  },
  {
    "videoId": "cJAI7tRGFpY",
    "title": "Uitziko San Migelen egunsentia",
    "publishedAt": "2025-09-29T14:21:39Z",
    "playlistId": "UUYibdEdQAPs55xBnIElKLkQ",
    "playlistName": "main"
  },
  {
    "videoId": "z1OMck6OAYc",
    "title": "Iglesia Navarra 20/03/2022",
    "publishedAt": "2022-06-08T13:31:21Z",
    "playlistId": "PLz726ILatoD0alRQu68k2XDie2DqlNwfU",
    "playlistName": "Más videos"
  },
  {
    "videoId": "nK7LRvERTtw",
    "title": "Día del Seminario - Marzo 2024 Pamplona (IV)",
    "publishedAt": "2024-03-19T10:00:41Z",
    "playlistId": "UUi7_mS3CCNOq6DCHytF99PA",
    "playlistName": "main"
  },
  {
    "videoId": "-JB5p9vxys4",
    "title": "Día del Seminario - Marzo 2024 Pamplona (III)",
    "publishedAt": "2024-03-17T10:00:00Z",
    "playlistId": "UUi7_mS3CCNOq6DCHytF99PA",
    "playlistName": "main"
  },
  {
    "videoId": "vRyvp15ud0w",
    "title": "Día del Seminario - Marzo 2024 Pamplona (II)",
    "publishedAt": "2024-03-15T10:00:51Z",
    "playlistId": "UUi7_mS3CCNOq6DCHytF99PA",
    "playlistName": "main"
  },
  {
    "videoId": "9EBorhB2W5w",
    "title": "Día del Seminario - Marzo 2024 Pamplona (I)",
    "publishedAt": "2024-03-13T10:00:09Z",
    "playlistId": "UUi7_mS3CCNOq6DCHytF99PA",
    "playlistName": "main"
  },
  {
    "videoId": "3ec20-3Dv_s",
    "title": "El seminario es nuestra casa ¡y la de todos!",
    "publishedAt": "2023-03-10T23:00:10Z",
    "playlistId": "UUi7_mS3CCNOq6DCHytF99PA",
    "playlistName": "main"
  },
  {
    "videoId": "uroYqWIaec4",
    "title": "Día del Seminario - 19 Marzo 2022 Pamplona (corto)",
    "publishedAt": "2022-03-20T08:57:42Z",
    "playlistId": "UUi7_mS3CCNOq6DCHytF99PA",
    "playlistName": "main"
  },
  {
    "videoId": "6VBJGh9U-Rw",
    "title": "Día del seminario - 19 Marzo 2022 (extendido)",
    "publishedAt": "2022-03-18T23:00:28Z",
    "playlistId": "UUi7_mS3CCNOq6DCHytF99PA",
    "playlistName": "main"
  }
]